bookEdition,NumberofRatings,title,author,id,description,numberofpages,GoodReadAverageRating,Language,bookformat
Three volume box set,17455,Skippy Dies,Paul Murray,7146335,"Why does Skippy, a fourteen-year-old boy at Dublin's venerable Seabrook College, end up dead on the floor of the local doughnut shop? ",661 pages,3.72,English,Paperback
Vintage Classics,16486,Brighton Rock,Graham Greene,48862,"Henry Graham Greene, OM, CH was an English novelist, short story writer, playwright, screenplay writer, travel writer and critic whose works explore the ambivalent moral and political issues of the modern world. Greene combined serious literary acclaim with wide popularity.",269 pages,3.72,English,Paperback
LCC 867900,16696,Wielding a Red Sword,Piers Anthony,76667,"Though he spent the first four years of his life in England, Piers never returned to live in his country of birth after moving to Spain and immigrated to America at age six. After graduating with a B.A. from Goddard College, he married one of his fellow students and and spent fifteen years in an assortment of professions before he began writing fiction full-time.",314 pages,3.93,English,Paperback
1st Edition,28469,Touch the Dark,Karen Chance,67513,The undead are another matter.,307 pages,3.7,English,Mass Market Paperback
Fiftieth Anniversary Edition,14035,The Road to Serfdom,Friedrich A. Hayek,299215," has inspired and infuriated politicians, scholars, and general readers for half a century. Originally published in England in the spring of 1944—when Eleanor Roosevelt supported the efforts of Stalin, and Albert Einstein subscribed lock, stock, and barrel to the so",274 pages,4.18,English,Paperback
First Edition,21816,Invincible (Chronicles of Nick #2),Sherrilyn Kenyon,8677937,"His new principal thinks he's even more of a hoodlum than the last one, his coach is trying to recruit him to things he can't even mention and the girl he's not seeing, but is,",420 pages,4.27,English,Hardcover
"Oxford World's Classics, UK / USA",16179,The Forsyte Saga,John Galsworthy,103159,Written with both c,872 pages,4.15,English,Paperback
Second Edition,13716,"Euthyphro, Apology, Crito, Meno, Phaedo",Plato,30292," presents G. M. A. Grube's distinguished translations, as revised by John Cooper for Plato, ",156 pages,4.1,English,Paperback
First English,17427,Дневной дозор,Sergei Lukyanenko,104160,"Set in a modern-day Moscow, the epic saga chronicles the eternal war of the ""Others,"" an ancient race of humans wi",453 pages,4.05,English,Paperback
Everyman Wodehouse,17185,The Code Of The Woosters,P.G. Wodehouse,105986,"Follow the adventures of Bertie Wooster and his gentleman’s gentleman, Jeeves, in this stunning new edition of one of the greatest comic novels in the English language. When Aunt Dahlia demands that Bertie Wooster help her dupe an antique dealer into selling her an 18th-century cow-creamer. Dahlia trumps Bertie's objections by threatening to sever his standing invitation to her house for lunch, an unthinkable prospect given Bertie's devotion to the cooking of her chef, Anatole. A web of complications grows as Bertie's pal Gussie Fink-Nottle asks for counseling in the matter of his impending marriage to Madeline Bassett. It seems Madeline isn't his only interest; Gussie also wants to study the effects of a full moon on the love life of newts. Added to the cast of eccentrics are Roderick Spode, leader of a fascist organization called the Saviors of Britain, who also wants that cow-creamer, and an unusual man of the cloth known as Rev. H. P. ""Stinker"" Pinker. As usual, butler Jeeves becomes a focal point for all the plots and ploys of these characters, and in the end only his cleverness can rescue Bertie from being arrested, lynched, and engaged by mistake!",286 pages,4.36,English,Hardcover
4th edition,16634,The Gun Seller,Hugh Laurie,45234,"Within hours Lang is butting heads with a Buddha statue, matching wits with evil billionaires, and putting his life (among other things) in the hands of a bevy of femmes fatales, wh",340 pages,3.69,English,Paperback
Petite Bibliothèque,17569,Frederick,Leo Lionni,375901,"Leo Lionni wrote and illustrated more than 40 highly acclaimed children's books. He received the 1984 American Institute of Graphic Arts Gold Medal and was a four-time Caldecott Honor Winner--for Inch by Inch, Frederick, Swimmy, and Alexander and the Wind-Up Mouse. Leo Lionni died in October of 1999 at his home in Tuscany, Italy, at the age of 89.",32 pages,4.19,French,Hardcover
First Edition,24768,Dream Chaser,Sherrilyn Kenyon,1746470,Xypher has one month on Earth to redeem himself through one good deed or be condemned to eternal torture in Tartarus. But redemption means little to a demigod who only wants vengeance on the one who caused his downfall.,369 pages,4.2,English,Mass Market Paperback
Second Edition,14514,Hellboy: Wake the Devil,Mike Mignola,102459,"Mike Mignola was born September 16, 1960 in Berkeley, California and grew up in nearby Oakland. His fascination with ghosts and monsters began at an early age (he doesn't remember why) and reading ",144 pages,4.2,English,Paperback
Oxford World's Classics,16743,Vingt ans après,Alexandre Dumas,7184,", is a supreme creation of suspense and heroic adventure.",788 pages,4.01,English,Paperback
First Edition,17414,Moonlight Mile ,Dennis Lehane,7853757,Amanda McCready was four years old when she vanished from a Boston neighborhood twelve years ago. Desperate pleas for help from the child's aunt led investigators Kenzie and Gennaro to take on the case. The pair risked everything to find the young girl—only to orchestrate her return to a neglectful mother and a broken home.,324 pages,3.71,English,Hardcover
Trade,17088,"The Unwritten, Volume 1: Tommy Taylor and the Bogus Identity",Mike Carey,6471550,"Tom Taylor's life was screwed from go. His father created the Tommy Taylor fantasy series, boy-wizard novels with popularity on par with Harry Potter. The problem is Dad modeled the fictional epic so closely to Tom's real life that fans are constantly comparing him to his counterpart, turning him into the lamest variety of Z-level celebrity. In the final novel, it's even implied that the fictional Tommy will crossover into the real world, giving delusional fans more excuses to harass Tom.",144 pages,3.76,English,Paperback
1st Edition,12738,The Krishna Key,Ashwin Sanghi,15733523,"In modern times, a poor little rich boy grows up believing that he is",475 pages,3.48,English,Paperback
First Edition,20385,The Dead in Their Vaulted Arches,Alan Bradley,17834904,"Moments later, he is dead,",315 pages,4.16,English,Hardcover
Slipcase,14195,S.,J.J. Abrams,17860739,"A young woman picks up a book left behind by a stranger. Inside it are his margin notes, which reveal a reader entranced by the story and by its mysterious author. She responds with notes of her own, leaving the book for the stranger, and so begins an unlikely conversation that plunges them both into the unknown.",456 pages,3.84,English,Hardcover
First Edition,18943,Dodger,Terry Pratchett,13516846,"Seventeen-year-old Dodger may be a street urchin, but he gleans a living from London's sewers, and he knows a jewel whe",360 pages,3.9,English,Hardcover
Razorbill,22570,Peeps,Scott Westerfeld,186103,"Last year as college freshman, narrator Cal was infected by exotic goth Morgan with a parasite that caused following girlfriends to become vampire-like ghouls he calls parasite-positives ""Peeps"". A carrier without symptoms, he hunts his progeny for the centuries old bureaucratic Night Watch. But victims are showing more sanity, pretty human Lacey is pushing his buttons, and her apartment building basement houses fierce hordes of ravening rats, red-eyed cats, and monstrous worms that threaten all. Morgan has the secret to a centuries-old conspiracy and upcoming battle to save the human race.",312 pages,3.77,English,Paperback
1st Edition,22136,Envy,Anna Godbersen,3347892, ,405 pages,3.91,English,Hardcover
Omnibus Edition,13950,"The Morganville Vampires, Volume 3",Rachel Caine,8462184,"In Morganville, violent black clouds promise a storm of devastating proportions. As student Claire Danvers and her friends prepare to defend Morganville against the elements - both natural ",446 pages,4.39,English,Paperback
1st edition,26947,"Rush Too Far (Too Far, #4)",Abbi Glines,18211536,Everyone in Rosemary Beach thinks they know how Rush Finlay and Blaire Wynn fell in love. But Rush is back to tell his side of the story...,242 pages,4.24,"
                  ",Kindle Edition
First Edition,15143,Ghost in the Wires: My Adventures as the World's Most Wanted Hacker,Kevin D. Mitnick,10256723,"Kevin Mitnick was the most elusive computer break-in artist in history. He accessed computers and networks at the world's biggest companies, and however fast the authorities were, Mitnick was faster, sprinting through phone switches, computer systems, and cellular networks. He spent years skipping through cyberspace, always three steps ahead and labeled unstoppable. For Mitnick, hacking wasn't just about technological feats; it was an old-fashioned confidence game that required guile and deception to trick the unwitting out of valuable information.",393 pages,3.95,English,Hardcover
Reissue,23946,The Fury,L.J. Smith,1169808,"Damon Mocking Stefan and Elena, he laughs in the face of doom.",285 pages,3.55,English,Mass Market Paperback
Disney,14245,Winnie the Pooh and Tigger Too,Walt Disney Company,2617684,"Walter Elias “Walt” Disney (December 5, 1901 – December 15, 1966) was an American film producer, director, screenwriter, voice actor, animator, entrepreneur,",40 pages,4.39,English,Hardcover
2nd edition,27809,B00DVEUGZ6,Jay McLean,18285151,"Jake, a handsome boy she just met, happens to witness her loss. With no one to turn to, Mikayla is forced",311 pages,4.15,                                  ,Kindle Edition
First US Edition,17379,"Lord of the Shadows (Cirque Du Freak, #11)",Darren Shan,8949,"Plagued by nightmares of what the future seems to hold, Darren feels uneasy revisiting the place where he was re-born as a child of the night, as though the universe (as though destiny) is plotting t",220 pages,4.22,English,Hardcover
First Edition,18658,Lady Friday,Garth Nix,17206,"Four of the seven Trustees have been defeated and their Keys taken, but for Arthur, the week is still getting worse. Suzy Blue and Fred Gold Numbers have been captured by the Piper, and his New Nithling army still controls most of the Great Maze. Superior Saturday is causing trouble wherever she can, including",320 pages,3.91,English,Hardcover
The Deluxe Edition,15158,Batman: Whatever Happened to the Caped Crusader?,Neil Gaiman,5599692, (,128 pages,3.97,English,Hardcover
Revised Edition,15539,The Great Influenza: The Epic Story of the Deadliest Plague in History,John M. Barry,29036,"At the height of WWI, history’s most lethal influenza virus erupted in an army camp in Kansas, moved east with American troops, then exploded, killing as many as 100 million people worldwide. It killed more people in twenty-four months than AIDS killed in twenty-four years, more in a year than the Black Death killed in a century. But this was not the Middle Ages, and 1918 marked the first collision of science and epidemic disease. Magisterial in its breadth of perspective and depth of research and now revised to reflect the growing danger of the avian flu, ",560 pages,3.95,English,Paperback
Large Print,17056,El Zorro,Isabel Allende,24796,"A swashbuckling adventure story that reveals for the first time how Diego de la Vega became the masked man we all know so well Born in southern California late in the eighteenth century, Diego de la Vega is a child of two worlds. His father is an aristocratic Spanish military man turned landowner; his mother, a Shoshone warrior. At the age of sixteen, Diego is sent to Spain, a country chafing under the corruption of Napoleonic rule. He soon joins La Justicia, a secret underground resistance movement devoted to helping the powerless and the poor. Between the New World and the Old, the persona of Zorro is formed, a great hero is born, and the legend begins. After many adventures -- duels at dawn, fierce battles with pirates at sea, and impossible rescues -- Diego de la Vega, a.k.a. Zorro, returns to America to reclaim the hacienda on which he was raised and to seek justice for all who cannot fight for it themselves.",677 pages,3.75,English,Paperback
1st Edition,17200,Out  アウト,Natsuo Kirino,25365,"The ringleader of this cover-up, Masako Katori, emerges as the emotional heart of ",400 pages,3.93,English,Paperback
First Edition,21601,U Is for Undertow,Sue Grafton,6193821,"It's April 1988, a month before Kinsey Millhone's thirty-eighth birthday, and she's alone in her office catching up on paperwork when a young man arrives unannounced. He has a preppy air about him and looks as if he'd be carded if he tried to buy a beer, but Michael Sutton is twenty-seven, an unemployed college dropout. More than two decades ago, a four-year-old girl disappeared, and a recent newspaper story about her kidnapping has triggered a flood of memories. Sutton now believes he stumbled on her lonely burial and could identify the killers if he saw them again. He wants Kinsey's help in locating the grave and finding the men. It's way more than a long shot, but he's persistent and willing to pay cash up front. Reluctantly, Kinsey agrees to give him one day of her time.",403 pages,3.93,English,Hardcover
LCC 856179,17757,With a Tangled Skein,Piers Anthony,76660,"Though he spent the first four years of his life in England, Piers never returned to live in his country of birth after moving to Spain and immigrated to America at age six. After graduating with a B.A. from Goddard College, he married one of his fellow students and and spent fifteen years in an assortment of professions before he began writing fiction full-time.",405 pages,3.98,English,Paperback
Trade,19776,"Saga, Volume Six",Brian K. Vaughan,28862528,: ,152 pages,4.49,English,Paperback
Signature Edition,23258,The Mirror Crack'd from Side to Side,Agatha Christie,16372,"Marina’s frozen expression suggested she had witnessed something horrific. But, while others searched for material evidence, Jane Marple conducted a very different investigatio",351 pages,3.89,English,Paperback
Abridged Junior Classic,19590,The Sword in the Stone,T.H. White,316845,", revised in ",352 pages,3.92,English,Paperback
Berkley Sensation,25909,A Lot Like Love,Julie James,8419428,"As the daughter of a billionaire and the owner of the city's top wine store, Jordan Rhodes is invited to the most exclusive parties in Chicago. But there's only one party the FBI wants to crash: the charity fundraiser of a famous restaurateur, who also happens to launder money for the mob. In exchange for her brother's release from prison, Jordan is going to be there—with a date supplied by the Bureau.",274 pages,4.09,English,Paperback
3rd Edition,33967,Axel,Harper Sloan,21518647,"Isabelle has learned the hard way how hard life can be when fate isn’t by your side. It can hand you dreams on silver platters, but it can snatch them right back and hand you nightmares. One thing Isabelle knew for sure fate was consistent with was taking away everything she ever",328 pages,4.13,"
                  ",Kindle Edition
2nd Edition,14920,Don't Make Me Think! A common sense approach to web usability,Steve Krug,3368,"Five years and more than 100,000 copies after it was first published, it's hard to imagine anyone working in Web design who hasn't read Steve Krug's ""instant classic"" on Web usability, but people are still discovering it every day. In this second edition, Steve adds three new chapters in the same style as the original: wry and entertaining, yet loaded with insights and practical advice for novice and veteran alike. Don't be surprised if it completely changes the way you think about Web design. ",201 pages,4.24,English,Paperback
First Scholastic Edition,19846,The Dark Hills Divide,Patrick Carman,81524," introduces readers to Alexa Daley, who annually visits the town of Bridewell. Alexa is curious about what lies beyond the massive ramparts that surround the city and the walled roads that link Bridewell to nearby towns; soon after town leader Thomas Warvold passes away, Alexa finds herself outside the walls, acquires a stone with remarkable powers, and discovers that she's meant to stop a potential war from occurring.",272 pages,3.71,English,Hardcover
1st Hardcover Edition,20798,Grim Tuesday,Garth Nix,47620,"Arthur doesn't think he will ever have to return to the strange house that nearly killed him on Monday -- the house that contains an entire world. But Tuesday brings new challenges -- in the form of an enemy named Grim Tuesday, who threatens the well-being of both Arthur's family and his world. Arthur",336 pages,3.86,English,Hardcover
First Edition,17688,Imperium,Robert   Harris,243601,"When Tiro, the confidential secretary (and slave) of a Roman senator, opens the door to a terrified stranger on a cold November morning, he sets in motion a chain of events that will eventually propel his master into one of the most suspenseful courtroom dramas in history. The stranger is a Sicilian, a victim of the island's corrupt Roman governor, Verres. The senator is Marcus Cicero -- an ambitious young lawyer and spellbinding orator, who at the age of twenty-seven is determined to attain ",305 pages,4.05,English,Hardcover
First American,22200,Nutshell,Ian McEwan,30008702,"Told from a perspective unlike any other, ",197 pages,3.71,English,Hardcover
Trade,22608,"Sex Criminals, Volume One: One Weird Trick",Matt Fraction,19536001,: ,128 pages,3.98,English,Paperback
The New Cambridge Shakespeare,20110,The Winter's Tale,William Shakespeare,44133,"The New Cambridge Shakespeare appeals to students worldwide for its up-to-date scholarship and emphasis on performance. The series features line-by-line commentaries and textual notes on the plays and poems and an extensive introduction. The Winter's Tale is one of Shakespeare's most varied, theatrically self-conscious, and emotionally wide-ranging plays. Much of the play's copiousness inheres in its generic intermingling of tragedy, comedy, romance, pastoral, and the history play. In addition to dates and sources, the introduction attends to iterative patterns, the nature and cause of Leontes' jealousy, the staging and meaning of the bear episode, and the thematic and structural implications of the figure of Time. Special attention is paid to the ending and its tempered happiness. Performance history is integrated throughout the introduction and commentary. Appendices include the theatrical practice of doubling.",279 pages,3.69,English,Paperback
25th Anniversary Edition; Reading Rainbow Book,20389,A Chair for My Mother ,Vera B. Williams,835202,"Graduate of Black Mountain College, North Carolina, where she majored in graphic art. In her own words, she has ""done graphic art, school teaching, children-raising [she has two daughters and a son], has run a bakery and been a cook in schools and restaurants."" (from back flap of book)",32 pages,4.2,English,Paperback
Trade,19344,"Fables, Volume 6: Homelands",Bill Willingham,21328,"Having beaten back the Adversary's first advance into their world, the residents of Fabletown must now prepare themselves for the full-scale war that is sure to follow. For one particular Fable, this means skipping town to launch a new career as a venal Hollywood mogul - a path he hopes will be paved with gold and immortality. For another Fable, though, it means a journey down a much more dangerous road - one that winds through the Fables' old Homelands into the very heart of enemy territory, where the mystery of the Adversary's identity will finally be revealed! ",192 pages,4.3,English,Paperback
First Edition,15752,The Evolutionary Void,Peter F. Hamilton,7438179,"Exposed as the Second Dreamer, Araminta has become the target of a galaxywide search by government agent Paula Myo and the psychopath known as the Cat, along with others equally determined to prevent-- or facilitate --the pilgrimage of the Living Dream cult into the heart of the Void. An indestructible microuniverse, the Void may contain paradise, as the cultists believe, but it is also a deadly threat. For the miraculous reality that exists inside its boundaries demands energy--energy drawn from everything outside those boundaries: from planets, stars, galaxies... from everything that lives. ",694 pages,4.26,English,Hardcover
Omnibus,19574,The Forbidden Game,L.J. Smith,7100490,But as Jenny and her six friends begin to play the Game at Tom's birthday cele,750 pages,4.19,English,Paperback
First Edition,19422,Peter and the Secret of Rundoon,Dave Barry,555500,"In this action-packed conclusion to the Starcatchers trilogy, Peter and Molly find themselves in the dangerous land of Rundoon, ruled by the evil King Zarboff, who takes great delight in watching his pet snake, Kundalini, consume anyone who displeases him. But that's just the start of the trouble facing our heroes, who once again find themselves pitted against the evil shadow creature Lord Ombra, in a struggle to save themselves and Molly's father - not to mention the entire planet - from an unthinkable end. Meanwhile, back in Never Land, a tribal war is under way, and while Peter is off fighting to save the world, a young Mollusk princess has no choice but to join forced with sinister pirates to save her island from the vicious Scorpions.",482 pages,4.16,English,Hardcover
First,15716,House of M,Brian Michael Bendis,105973,"The Marvel event of the decade is here! The Avengers and the X-Men are faced with a common foe that becomes their greatest threat: Wanda Maximoff! The Scarlet Witch is out of control, and the fate of the entire world is in her hands. Will Magneto help his daughter or use her powers to his own benefit? Starring the Astonishing X-Men and the New Avengers! You know how sometimes you hear the phrase: and nothing will ever be the same again? Well, this time believe it, buster! Nothing will ever be the same again!",224 pages,3.97,English,Paperback
UK edition,17418,The Crimson Campaign,Brian  McClellan,17608111,"Tamas's invasion of Kez ends in disaster when a Kez counter-offensive leaves him cut off behind enemy lines with only a fraction of his army, no supplies, and no hope of reinforcements. Drastically outnumbered and pursued by the enemy's best, he must lead his men on a reckless march through northern Kez to safety, and back over the mountains so that he can defend his country from an angry god. In Adro, Inspector Adamat only wants to rescue his wife. To do so he must track down and confront the evil Lord Vetas. He has questions for Vetas concerning his enigmatic master, but the answers might come too quickly. With Tamas and his powder cabal presumed dead, Taniel Two-shot finds himself alongside the god-chef Mihali as the last line of defence against Kresimir's advancing army. Tamas's generals bicker among themselves, the brigades lose ground every day beneath the Kez onslaught, and Kresimir wants the head of the man who shot him in the eye.",596 pages,4.36,English,Hardcover
Omnibus,20285,Crown Duel ,Sherwood Smith,21060,"Young Countess Meliara swears to her dying father that she and her brother will defend their people from the growing greed of the king. That promise leads them into a war for which they are ill-prepared, which threatens the very people they are trying to protect. But war is simple compared to what follows, in peacetime. Meliara is summoned to live at the royal palace, where friends and enemies look alike, and intrigue fills the dance halls and the drawing rooms. If she is to survive, Meliara must learn a whole new way of fighting-with wits and words and secret alliances.",471 pages,4.19,English,Paperback
Reprint Edition,14774,The Poetry of Pablo Neruda,Pablo Neruda,5936,"""In his work a continent awakens to consciousness."" So wrote the Swedish Academy in awarding the Nobel Prize to Pablo Neruda, the author of more than thirty-five books of poetry and one of Latin America's most revered wri",1040 pages,4.44,English,Paperback
First Edition,17319,"
                  9385152149
                      ",Amish Tripathi,24709327,3400 BCE. INDIA,354 pages,3.69,"
                  ",Paperback
30th Anniversary Edition,16450,On Writing Well: The Classic Guide to Writing Nonfiction,William Zinsser,53343," has been praised for its sound advice, its clarity and the warmth of its style. It is a book for everybody who wants to learn how to write or who needs to do some writing to get through the day, as almost everybody does in the age of e-mail and the Internet. Whether you want to write about people or places, science and technology, business, sports, the arts or about yourself in the increasingly popular memoir genre, ",336 pages,4.24,English,Paperback
Second Edition,15765,Utilitarianism,John Stuart Mill,584637, includes the text of his 1868 speech to the British House of Commons defending the use of capital punishment in cases of aggravated murder. The speech is significant both because its topic remains timely and because its arguments illustrate the applicability of the principle of utility to questions of large-scale s,71 pages,3.65,English,Paperback
Agatha Christie Signature Edition,21835,The Big Four,Agatha Christie,16316,"Who was he? Was he suffering from shock or just exhaustion? Above all, what was the significance of the figure 4, scribbled over and over again on a sheet of paper? Poirot finds himself plunged into a world",272 pages,3.6,English,Paperback
