Language,numberofpages,author,bookEdition,description,title,GoodReadAverageRating,bookformat,NumberofRatings,id
English,300 pages,Louise Fitzhugh,Classic Edition,"Harriet M. Welsch is a spy. In her notebook, she writes down everything she knows about everyone, even her classmates and her best friends. Then Harriet loses track of her notebook, and it ends up in the wrong hands. Before she can stop them, her friends have read the always truthful, sometimes awful things she’s written about each of them. Will Harriet find a way to put her life and her friendships back together?",Harriet the Spy,3.96,Mass Market Paperback,80837,232576
English,310 pages,Janet Evanovich,First Edition,MISTAKE #1,Lean Mean Thirteen,4.08,Hardcover,78177,40317
English,434 pages,Jodi Picoult,First Washington Square Press Trade Paperback Edition,"When Jack St. Bride arrives by chance in the sleepy New England town of Salem Falls, he decides to reinve",Salem Falls,3.8,Paperback,62692,10915
English,364 pages,D.H. Lawrence,Penguin Classics Deluxe Edition,"With her soft brown hair, lithe figure and big, wondering eyes,",Lady Chatterley's Lover,3.49,Paperback,76429,32067
English,208 pages,Greg Behrendt,The Newly Expanded Edition,"Now in bite-size mantras, the abridged empathetic wit and wisdom of the number one ",He's Just Not That Into You: The No-Excuses Truth to Understanding Guys,3.65,Hardcover,56107,10412
"
                  ",452 pages,Jodi Ellen Malpas,2nd Edition,"Jesse Ward drowned her with his intensity and blindsided her with his passion, but he kept her away from his dark secrets and broken soul. Leaving him was the only way Ava O'Shea could survive. She should have known that Jesse Ward is impossible to escape--and now he's back in her life, determined to remind her of the sensual pleasures",Beneath This Man ,4.3,Kindle Edition,74797,18149927
English,322 pages,Maureen Johnson,Extras Inside,Maureen knew from an early age she wanted to be a writer. She went to high school at an all-girls' Catholic school and graduated from University of Delaware with a degree in writing. She now lives and writes in New York City.,13 Little Blue Envelopes,3.65,Paperback,71097,17020
"
                ",688 pages,Brandon Sanderson,Draft version," and following up with his blockbuster Mistborn trilogy, Brandon Sanderson proves again that he is today's leading master of what Tolkien called ""secondary creation,"" the invention of whole worlds, complete with magics and myths all their own.",Warbreaker,4.22,ebook,66440,1268479
English,236 pages,Ally Carter,First Edition,". At first, giddy anticipation is in the air. Gallagher Academy, Cammie's elite spy school, is hosting a visit from a covert training center for boys. Soon after the boys' arrival, though, everything goes dangerously awry when a s",Cross My Heart and Hope to Spy,4.13,Hardcover,73725,568645
English,515 pages,Jim Butcher,1st Edition,"After being murdered by a mystery assailant, navigating his way through the realm between life and death, and being brought back to the mortal world, Harry realizes that maybe death wasn’t all that bad. Because he is no longer Harry Dresden, Chicago’s only professional wizard.",Cold Days,4.51,Hardcover,66541,12216302
English,822 pages,Terry Goodkind,Unabridged,"The dangerous, fanatical Imperi","Temple of the Winds (Sword of Truth, #4)",4.03,Audio CD,63114,253058
English,320 pages,Kendare Blake,First Edition,"So did his father before him, until he was gruesomely murdered by a ghost he sought to kill. Now, armed with his father's mysterious and deadly athame, Cas travels the country with his kitchen-witch mother and their spirit-sniffing cat. They follow legends and local lore, destroy the murderous dead, and keep p",Anna Dressed in Blood,3.96,Hardcover,78772,9378297
English,464 pages,Michael Scott,First Edition,"After fleeing Ojai, Nicholas, Sophie, Josh, and Scatty emerge in Paris, the City of Lights. Home for Nicholas Flamel. Only this homecoming is anything but sweet. Perenelle is still locked up back in Alcatraz and Paris is teeming with enemies. Niccolo Machiavelli, immortal author and celebrated art collector, is working for Dee. He’s after them, and time is running out for Nicholas and Perenelle. For every day spent without the Book of Abraham the Mage, they age one year-their magic becoming weaker and their bodies more frail. For Flamel, the Prophecy is becoming more and more clear.",The Magician: The Secrets of The Immortal Nicholas Flamel,4.09,Hardcover,72501,2402971
"
                  ",58 pages,Hugh Howey,1st Edition,Or you'll get what you wish for.,Wool,4.12,Kindle Edition,60460,12287209
English,354 pages,Anne Rice,Limited Edition,"In the fifth Vampire Chronicle, Lestat is searching for Dora, the beautiful and charismatic mortal daughter of a drug lord. Dora has moved Lestat like no other mortal ever has, and he cannot get her out of his visions. At the same time, he is increasingly aware that the Devil knows who he is and wants something from him. While torn betwen his vampire world and his passion for Dora, Lestat is sucked in by Memnoch, who claims to be the Devil himself. Memnoch presents Lestat with unimagined opportunities: to witness creation, to visit purgatory, to be treated like a prophet. Lestat faces a choice between the Devil or God. Whom does he believe in? Who does he serve? What are the element of religious belief? Lestat finds himself caught in a whirlpool of the ultimate choice",Memnoch The Devil,3.74,Hardcover,67717,31338
English,310 pages,Janet Evanovich,1st Edition, ,Twelve Sharp,4.14,Hardcover,79746,3507
English,374 pages,Lee Child,Unabridged,"Skilled, cautious, and anonymous, Jack Reacher is perfect for the job: to assassinate the vice president of the United States. Theoretically, of course. A female Secret Service agent wants Reacher to find the holes in her system, and fast - because a covert group already has the vice president in their sights. They've planned well. There's just one thing they didn't plan on: Reacher.",Without Fail ,4.16,Audiobook,64052,21745
English,352 pages,Nora Roberts,Unabridged - Library Ed,"The historic hotel in Boonsboro has endured war and peace, changing hands, even rumored hauntings. Now it’s getting a major facelift from the Montgomery brothers and their eccentric mother. Beckett is the architect of the family, and his social life consists mostly of talking shop over pizza and beer. But there’s another project he’s got his eye on: the girl he’s been waiting to kiss since he was fifteen.",The Next Always,4.11,Audio CD,63478,10305231
English,544 pages,Walter Scott,Penguin Classics," (1819) was the first of Scott's novels to adopt a purely English subject and was also his first attempt to combine history and romance, which later influenced Victorian medievalism. Set at the time of the Norman Conquest, Ivanhoe returns from the Crusades to claim his inheritance and the love of Rowena and becomes involved in the struggle between Richard Coeur de Lion and his Norman brother John. The gripping narrative is structured by a series of conflicts: Saxon versus Norman, Christian versus Jew, men versus women, played out against Scott's unflinching moral realism.",Ivanhoe,3.75,Paperback,71825,6440
English,438 pages,Jim Butcher,1st Edition,"Now Arianna Ortega, Duchess of the Red Court, has discovered a secret Susan has",Changes,4.54,Hardcover,73171,6585201
English,384 pages,Daniel Goleman,10th Anniversary Edition,", we could only guess why. Daniel Goleman's brilliant report from the frontiers of psychology and neuroscience offers startling new insight into our ""two minds""—the rational and the emotional—and how they together shape our destiny.",Emotional Intelligence,3.98,Hardcover,53743,26329
English,485 pages,Raymond E. Feist,Author's Preferred Edition,"Raymond E. Feist was born Raymond E. Gonzales III, but took his adoptive step-father's surname when his mother remarried Felix E. Feist. He graduated with a B.A. in Communication Arts with Honors in 1977 from the University of California at San Diego. During that year Feist had some ideas for a novel about a boy who would be a magician. He wrote the novel two years later, and it was published in 1",Magician,4.17,Mass Market Paperback,65429,13812
English,368 pages,Stephen King,First Edition,"The story opens with the confession of Wilfred James to the murder of his wife, Arlette, following their move to Hemingford, Nebraska onto land willed to Arlette by her father.","Full Dark, No Stars",4.03,Hardcover,70001,7912007
English,307 pages,Melissa de la Cruz,1st Edition,"Schuyler Van Alen is starting to get more comfortable with her newfound vampire powers, but she still has many unanswered questions. A trip to Italy in search of her grandfather only serves to make things more confusing. What secrets are the leaders of The Committee hiding? Meanwhile, back in New York, preparations are feverishly underway for the famous Four Hundred Ball. In true Blue Blood fashion, the ball is totally fab, complete with masksâ€”and hidden behind this masquerade is a revelation that will change the course of a young vampireâ€™s destiny.",Masquerade,3.91,Hardcover,79916,106085
English,704 pages,Robert Jordan,First Edition, from the ,Crossroads of Twilight,3.82,Hardcover,68996,113435
English,303 pages,Randall Munroe,First Edition,"Randall Munroe left NASA in 2005 to start up his hugely popular site XKCD 'a web comic of romance, sarcasm, math and language' which offers a witty take on the world of science and geeks. It now has 600,000 to a million page hits daily. Every now and then, Munroe would get emails asking him to arbitrate a science debate. 'My friend and I were arguing about what would happen if a bullet got struck by lightning, and we agreed that you should resolve it . . . ' He liked these questions so much that he started up ",What If?: Serious Scientific Answers to Absurd Hypothetical Questions,4.17,Hardcover,73499,21413662
English,499 pages,Neal Stephenson,Trade Reissue,"The Diamond Age: Or, A Young Lady's Illustrated Primer is a postcyberpunk novel by Neal Stephenson. It is to some extent a science fiction coming-of-age story, focused on a young girl named Nell, and set in a future world in which nanotechnology affects all aspects of life. The novel deals with themes of education, social class, ethnicity, and the nature of artificial intelligence.",The Diamond Age,4.19,Paperback,67069,827
English,159 pages,Patrick Rothfuss,First Edition,"Her name is Auri, and she is full of mysteries.",The Slow Regard of Silent Things,3.92,Hardcover,72003,21535271
"
                  ",363 pages,Solomon Northup,Enhanced Edition,"Perhaps the best written of all the slave narratives, Twelve Years a Slave is a harrowing memoir about one of the darkest periods in American history. It recounts how Solomon Northup, born a free man in New York, was lured",Twelve Years a Slave,4.16,ebook,65665,18478222
English,528 pages,J.R. Ward,First Edition,"John Matthew has come a long way since he was found living among humans, his vampire nature unknown to himself and to those around him. After he was taken in by the Brotherhood, no one could guess what his true history was- or his true identity. Indeed, the fallen Brother Darius has returned, but with a different face and a very different destiny. As a vicious personal vendetta takes John into the heart of the war, he will need to call up on both who he is now and who he once was in order to face off against evil incarnate.","Lover Avenged, part one",4.41,Hardcover,90531,7046495
"
                  ",278 pages,Frank Warren,First Edition,"You are invited to anonymously contribute a secret to a group art project. Your secret can be a regret, fear, betrayal, desire, confession, or childhood humiliation. Reveal ",PostSecret: Extraordinary Confessions from Ordinary Lives,4.01,Hardcover,59727,87640
English,640 pages,Stephen King,Film tie-in,"Stephen King, whose first novel, Carrie, was published in 1974, the year before the last U.S. troops withdrew from Vietnam, is the first hugely popular writer of the TV generation. Images from that war -- and the",Hearts in Atlantis,3.8,Paperback,71353,11602
English,527 pages,J.R. Ward,First Edition,"Rehvenge has always kept his distance from the Brotherhood—even though his sister is married to a member, for he harbors a deadly secret that could make him a huge liability in their war against the lessers. As plots within and outside of the Brotherhood threaten to reveal the truth about Rehvenge, he turns to the only source of light in his darkening world, Ehlena, a vampire untouched by the corruption that has its hold on him—and the only thing standing between him and eternal destruction.","Lover Enshrined, part two",4.38,Hardcover,92911,5098079
"
                  ",331 pages,أحلام مستغانمي,الطبعة الأولى,الموسيقى لا تمهلك، إنها تمضي بك سراعا كما الحياة، جدولا طربا، أو شلالا هادرا يلقي بك إلى المصب. تدور بك كفالس محموم، على إيقاعه تبدأقصص الحب ...و تنتهي.,الأسود يليق بك,3.71,Paperback,52554,16081961
                                  ,448 pages,Jodi Ellen Malpas,1st edition,"Young interior designer Ava O’Shea has an appointment for a first consultation at The Manor with the owner, Mr Jesse Ward. She is expecting nothing more than an overweight, cravat wearing, well-to-do countryman, and on arrival, nothing would suggest otherwise. How wrong could she be? This Man is devastatingly handsome, charming and confident. He is also a conceited, hedonistic playboy, who knows no boundaries. Ava desperately does not want to be attracted to him, but she can’t control the overwhelming effect he has on her. Every instinct is telling her to run, so she does, but Jesse Ward is not so willing to let her go. He wants her and is determined to have her. She knows she is heading for heartbreak, but how can she run when he won’t let her?",This Man,4.13,ebook,85583,16140036
English,443 pages,Adam Johnson,US / CAN,"Pak Jun Do is the haunted son of a lost mother - a singer ""stolen"" to Pyongyang - and an influential father who runs Long Tomorrows, a work camp for orp",The Orphan Master's Son,4.06,Hardcover,64316,11529868
English,134 pages,George Bernard Shaw,Dover Thrift Edition,"Shaw wrote the part of Eliza Doolittle - an east-end dona with an apron and three orange and red ostrich feathers - for Mrs Patrick Campbell, with whom he had a passionate but unconsummated affair. From the outset the play was a sensational success, although Shaw, irritated by its popularity at the expense of his artistic intentions, dismissed it as a potboiler. The Pygmalion of legend falls in love with his perfect female statue and persuades Venus to bring her to life so that he can marry her. But Shaw radically reworks Ovid's tale to give it a feminist slant: while Higgins teaches Eliza to speak and act like a duchess, she also asserts her independence, adamantly refusing to be his creation.",Pygmalion,3.9,Paperback,75907,7714
English,224 pages,Jeff Kinney,First Edition,"Greg Heffley is in big trouble. School property has been damaged, and Greg is the prime suspect. But the crazy thing is, he’s innocent. Or at least sort of. The authorities are closing in, but when a surprise blizzard hits, the Heffley family is trapped indoors. Greg knows that when the snow melts he’s going to have to face the music, but could any punishment be worse than being stuck inside with your family for the holidays?",Cabin Fever,4.21,Hardcover,69214,11254250
English,376 pages,Joe Hill,First Edition,"Aging, self-absorbed rock star Judas Coyne has a thing for the macabre -- his collection includes sketches from infamous serial killer John Wayne Gacy, a trepanned skull from the 16th century, a used hangman's noose, Aleister Crowley's childhood chessboard, etc. -- so when his assistant tells him about a ghost for sale on an online auction site, he immediately puts in a bid and purchases it. ",Heart-Shaped Box,3.82,Hardcover,75290,153025
English,562 pages,William Styron,Vintage International Edition,"William Styron (1925–2006), born in Newport News, Virginia, was one of the greatest American writers of his generation. Styron published his first book, ",Sophie's Choice,4.18,Paperback,71442,228560
"
                  ",160 pages,Roberto Aguirre-Sacasa,1st," series of comics (#1-5) into one Hardcover volume. It all begins here: the epic apocalyptic battle between good and evil. On a secret army base in the Californian desert, something has gone horribly, terribly wrong. Something will send Charlie Campion, his wife and daughter fleeing in the middle of the night. U","
                  0785136207
                      ",4.43,Hardcover,58078,6344097
English,1614 pages,William L. Shirer,50th Anniversary Edition,Hitler boasted that The Third Reich would last a thousand years. It lasted only 12. But those 12 years contained some of the most catastrophic events Western civilization has ever known.,The Rise and Fall of the Third Reich: A History of Nazi Germany,4.15,Mass Market Paperback,68978,767171
English,138 pages,Jeff Smith,1st Edition,"After being run out of Boneville, the three Bone cousins, Fone Bone, Phoney Bone, and Smiley Bone, are separated and lost in a vast uncharted desert.",Out from Boneville,4.16,Paperback,63489,106134
English,374 pages,Veronica Rossi,UK Edition,Then Aria meets an outsider name,Under the Never Sky,4.0,Paperback,94915,11594257
English,625 pages,Robert K. Massie,First edition,"Born into minor German nobility, she transformed herself into an empress by sheer determination. Possessing a brilliant, curious mind, she devoured the works of Enlightenment philosophers, and reaching the throne, tried using their princ",Catherine the Great: Portrait of a Woman,3.91,Hardcover,70681,10414941
English,431 pages,Margaret Atwood,First United States Edition,"The times and species have been changing at a rapid rate, and the social compact is wearing as thin as environmental stability. Adam One, the kindly leader of the God's Gardeners--a religion devoted to the melding of science and religion, as well as the preservation of all plant and animal life--has long predicted a natural disaster that will alter Earth as we know it. Now it has occurred, obliterating most human life. Two women have survived: Ren, a young trapeze dancer locked inside the high-end sex club Scales and Tails, and Toby, a God's Gardener barricaded inside a luxurious spa where many of the treatments are edible. ",The Year of the Flood,4.05,Hardcover,77981,6080337
English,635 pages,Cornelia Funke,1st US Edition,"Although a year has passed, not a day goes by without Meggie thinking of INKHEART, the book whose characters became real. But for Dustfinger, the fire-eater brought into being from words, the need",Tintenblut,3.91,Hardcover,90832,28195
English,253 pages,Chuck Klosterman,1st Scribner trade paperback edition,"Countless writers and artists have spoken for a generation, but no one has done it quite like Chuck Klosterman. With an exhaustive knowledge of popular culture and an almost effortless ability to spin brilliant prose out of unlikely subject matter, Klosterman attacks the entire spectrum of postmodern America: reality TV, Internet porn, Pamela Anderson, literary Jesus freaks, and the real difference between apples and oranges (of which there is none). And don't even get him started on his love life and the whole Harry-Met-Sally situation. ","Sex, Drugs, and Cocoa Puffs: A Low Culture Manifesto",3.75,Paperback,58067,599
English,288 pages,Anna Quindlen,Delta Fiction,"Now she is starting over in a city far from home, far fr",Black and Blue,3.86,Paperback,69965,5157
"
                  ",385 pages,أحمد مراد,الطبعة الاولى,"في ""8 غرب""، القسم الذي يقرّر مَصير مُرتكبي الجرائم، يُقابل صديقاً قديماً يحمل إليه ماضياً جاهد طويلاً لينساه، ويصبح مَصيره فجأة بين يدي يحيى..",الفيل الأزرق,3.8,Paperback,54568,16031620
English,217 pages,Jeff Kinney,First Edition,"Greg suddenly finds himself dealing with the pressures of boy-girl parties, increased responsibilities, and even the awkward changes that come with getting older—all without his best friend, Rowley, at his side. Can Greg make it through on his own? Or will he have to f",The Ugly Truth,4.16,Hardcover,73789,7823678
English,909 pages,Robert Jordan,First,"In the Field of Merrilor the rulers of the nations gather to join behind Rand al’Thor, or to stop him from his plan to br",A Memory of Light,4.5,Hardcover,76727,7743175
"
                  ",780 pages,Robert Jordan,First Mass Market Edition,"Mazrim Taim, leader of the Black Tower, is revealed to be a liar. But what is he up to?","
                  081257558X
                      ",3.92,Mass Market Paperback,78148,13891
English,416 pages,Peter V. Brett,First Edition,"As darkness falls after sunset, the corelings rise—demons who possess supernatural powers and burn with a consuming hatred of humanity. For hundreds of years the demons have terrorized the night, slowly culling the human herd that shelters behind magical wards—symbols of power whose origins are lost in myth and whose protection is terrifyingly fragile. It was not always this way. Once, men and women battled the corelings on equal terms, but those days are gone. Night by night the demons grow stronger, while human numbers dwindle under their relentless assault. Now, with hope for the future fading, three young survivors of vicious demon attacks will dare the impossible, stepping beyond the crumbling safety of the wards to risk everything in a desperate quest to regain the secrets of the past. Together, they will stand against the night.",The Painted Man,4.27,Hardcover,78681,3428935
"
                  ",128 pages,Emily Seife,First Edition,"Here is the ultimate guide to the twenty-fourth annual Hunger Games. Follow the tributes' journey from the reaping to the Games, with an exclusive look at all the highlights along the way—the trip to the Capitol, t","
                  0545457823
                      ",4.4,Paperback,68745,13027304
English,827 pages,Marissa Meyer,1st,"Winter despises her stepmother, and knows Levana won't approve of her feelings for her childhood friend--the handsome palace guard, Jacin. But Winter isn't as weak as L",Winter,4.49,Hardcover,113185,13206900
English,178 pages,Robert Louis Stevenson,Penguin Classics,"Published as a 'shilling shocker', Robert Louis Stevenson's dark psychological fantasy gave birth to the idea of the split personality. The story of respectable Dr Jekyll's strange association with 'damnable young man' Edward Hyde; the hunt through fog-bound London for a killer; and the final revelation of Hyde's true identity is a chilling exploration of humanity's basest capacity for evil. The other stories in this volume also testify to Stevenson's inventiveness within the Gothic tradition: ""Olalla', a tale of vampirism and tainted family blood, and 'The Body Snatcher', a gruesome fictionalisation of the exploits of the notorious Burke and Hare.",The Strange Case of Dr. Jekyll and Mr. Hyde and Other Tales of Terror ,3.94,Paperback,81734,51497
English,444 pages,Malcolm Gladwell,Large Print,"In the past decade, Malcolm Gladwell has written three books that have radically changed how we understand our world",What the Dog Saw and Other Adventures,3.82,Hardcover,71108,6516450
English,536 pages,Joe Abercrombie,First Edition,"With too many masters and too little time, Superior Glokta i",Last Argument of Kings,4.26,Trade Paperback,74051,944076
English,688 pages,Karin Slaughter,Large print,Sisters. Strangers. Survivors.,Pretty Girls,3.95,Paperback,89340,25574782
English,531 pages,Anonymous,2013 Edition,"The book was written by many ancient prophets by the spirit of prophecy and revelation. Their words, written on gold plates, were quoted and abridged by a p",The Book of Mormon,4.37,Paperback,66352,323355
English,210 pages,Eiichirō Oda,SHONEN JUMP Manga Edition,"As a child, Monkey D. Luffy was inspired to become a pirate by listening to the tales of the buccaneer ""Red-Haired"" Shanks. But his life changed when he accidentally ate the fruit of the Gum-Gum Tree and gained the power to stretch like rubber...at the cost of never being able to swim again! Years later, still vowing to become the king of the pirates, Luffy sets out on his adventure...one guy alone in a rowboat, in search of the legendary ""One Piece,"" said to be the greatest treasure in the world...","One Piece, Volume 01",4.42,Paperback,68505,1237398
English,302 pages,Cormac McCarthy,First Vintage Edition,"Cormac McCarthy is an American novelist and playwright. He has written ten novels in the Southern Gothic, western, and post-apocalyptic genres and has also written plays and screenplays. He received the Pulitzer Prize in 2007 for ",All the Pretty Horses,3.97,Paperback,73635,469571
English,430 pages,Erik Larson,First Edition,"On May 1, 1915, with WWI entering its tenth month, a luxury ocean liner as richly appointed as an English country house sailed out of New York, bound for Liverpool, carrying a record number of children and infants. The passengers were surprisingly at ease, even though Germany had declared the seas around Britain to be a war zone. For months, German U-boats had brought terror to the North Atlantic. But the ",Dead Wake: The Last Crossing of the Lusitania,4.07,Hardcover,74063,22551730
