Language,numberofpages,author,bookEdition,description,title,GoodReadAverageRating,bookformat,NumberofRatings,id
English,272 pages,Agatha Christie,Agatha Christie Signature Edition,"Who was he? Was he suffering from shock or just exhaustion? Above all, what was the significance of the figure 4, scribbled over and over again on a sheet of paper? Poirot finds himself plunged into a world",The Big Four,3.6,Paperback,21835,16316
English,366 pages,Fritjof Capra,25th Anniversary Edition," includes a new preface and afterword in which the author reviews the developments of the twenty-five years since the book's first publication, discusses criticisms the book has received, and examines future possibilities for a new sc",The Tao of Physics: An Exploration of the Parallels Between Modern Physics and Eastern Mysticism,3.96,Paperback,13853,10238
English,400 pages,Larissa Ione,US edition,"As the only female Seminus demon ever born, master assassin Sinead Donnelly is used to being treated like an outcast. She spent decades enslaved, and now vows she'll die before she'll relinquish her freedom again. Then Sin's innate ability to kill her enemies goes awry: She creates a lethal new werewolf virus that sparks a firestorm of panic and violence",Sin Undone,4.35,Mass Market Paperback,24056,7715664
English,269 pages,Joseph O'Neill,First American Edition,"In a New York City made phantasmagorical by the events of 9/11, Hans--a banker originally from the Netherlands--finds himself marooned among",Netherland,3.4,Hardcover,15792,2615008
English,453 pages,Bernard Cornwell,First,". It has always been held to be the triumph of the longbow against the armoured knight, and of the comm",Azincourt ,4.11,Hardcover,18032,3276012
English,740 pages,Anonymous,3rd,", or Book of Changes, is one of the 1st efforts of the human mind to place itself within the universe. It has exerted a living influence in China for 3000 years and interest in it has spread in the West. ",易 [Yì],4.18,Hardcover,14762,534289
English,528 pages,James Patterson,Large print,"Now his cousin Stefan has been accused of a horrible, unthinkable murder, and Cross drives south with Bree, Nana Mama, Jannie, and Ali to Starksville, North Carolina, for the first time in thirty-f",Cross Justice,4.22,Hardcover,16666,25066591
English,512 pages,Joseph Wambaugh,Reprint,"Joseph Wambaugh, a former LAPD detective sergeant (1960-1974), is the bestselling author of twenty-one prior works of fiction and nonfiction, including The Choirboys and The Onion Field. Wambaugh joined the Los Angeles Police Department (LAPD) in 1960. He served 14 years, rising to detective sergeant. He also attended California State University, Los Angeles, where he earned Bachelor of Arts and M",The Onion Field,4.13,Paperback,16072,487445
English,102 pages,Stephen Briggs,Stage Adaptation,who graduated from Curtin University with a double major in Theatre Arts and Creative Writing before attending WAPPA and studying Broadcasting. Midway through his time there he decided he didn't want to be a journo and moved,Interesting Times,4.1,Paperback,19277,34508
English,312 pages,Janet Evanovich,First Edition,"Janet Evanovich is the #1 New York Times bestselling author of the Stephanie Plum series, the Lizzy and Diesel series, twelve romance novels, the Alexandra Barnaby novels and Trouble Maker graphic novel, and How I Write: Secrets of a Bestselling Author, as well as the Fox and O'Hare series with co-author Lee Goldberg.",Motor Mouth,3.66,Hardcover,22295,6426
English,350 pages,Cornelius Ryan,First Touchstone Edition,"The Longest Day is Cornelius Ryan's unsurpassed account of D-Day, a book that endures as a masterpiece of military history. In this compelling tale of courage and heroism, glory and tragedy, Ryan painstakingly recreates the fateful hours that preceded and followed the massive invasion of Normandy to retell the story of",The Longest Day,4.31,Paperback,16001,161156
English,14 pages,J.D. Robb,Unabridged,"Twelve years ago, Eve Dallas was just a rookie NY cop when her instincts led her to the apartment of Isaac McQueen, a man she discovered to be a sick murderer and pedophile, who was keeping young girls in cages. Now a homicide Lieutenant, Eve is one of the most distinguished officers in the city—and then she learns that McQueen has escaped from jail. Bent on revenge against Eve and with a need to punish more ""bad girls"" McQueen heads to Dallas, Texas—the place where Eve was found as a child, the place where she killed her own abusive monster when she was only eight years old. With Eve and Roarke in pursuit of McQueen, everything is on the line and secrets from Eve's past are about to be shockingly revealed.",New York to Dallas,4.42,Audio CD,21230,10402992
                                  ,384 pages,Lisa Renee Jones,Second,"One day I was a high school teacher on summer break, leading a relatively uneventful but happy life. Or so I told myself. Later, I’d question that, as I would question pretty much everything I knew about me, my relationships, and my desires. It all began when my neighbor thrust a key to a storage unit at me. She’d bought it to make extra money after watc",If I were you,4.14,ebook,24044,15717721
English,304 pages,Sarah McCoy,First Edition,"In 1945, Elsie Schmidt is a naive teenager, as eager for her first sip of champag",The Baker's Daughter,3.95,Hardcover,17027,12547098
English,365 pages,Laurell K. Hamilton,First Edition,Bearing an hei,Swallowing Darkness,4.13,Hardcover,25308,2798094
English,452 pages,Rachel Caine,Omnibus Edition,"Morganville is a small college town in the heart of Texas that has its share of quirky characters - and some evil ones too. When student Claire Danvers moves off campus into one of Morganville's oldest houses, she finds that her roommates don't show many signs of life. But they'll have Claire's back when the town's deepest secrets come crawling out, hungry for fresh blood.","The Morganville Vampires, Volume 1",4.36,Paperback,17438,6571723
English,208 pages,Nathanael West,First Signet Classic Printing," is a novel about Hollywood and its corrupting touch, about the American dream turned into a sun-drenched California nightmare. Nathanael West's Hollywood is not the glamorous ""home of the stars"" but a seedy world of little people, some hopeful, some despairing, all twisted by their by their own desires -- from the ironically romantic artist narrator to a macho movie cowboy, a middle-aged innocent from America's heartland, and the hard-as-nails call girl would-be-star whom they all lust after. An unforgettable portrayal of a world that mocks the real and rewards the sham, turns its back on love to plunge into empty sex, and breeds a savage violence that is its own undoing, this novel stands as a classic indictment of all that is most extravagant and uncontrolled in American life.",The Day of the Locust,3.78,Paperback,16795,113441
English,147 pages,Melissa de la Cruz,1st Edition,In ,Bloody Valentine,3.98,Hardcover,21009,7817785
English,661 pages,Paul Murray,Three volume box set,"Why does Skippy, a fourteen-year-old boy at Dublin's venerable Seabrook College, end up dead on the floor of the local doughnut shop? ",Skippy Dies,3.72,Paperback,17455,7146335
"
                  ",330 pages,Michelle A. Valentine,1st edition,"For the last four years, good girl Lane has regretted breaking up with Noel Falcon. She thought she was sensible when she told him his dreams of being a rock star would get him nowhere, but now that he's a rock god and her career is stagnant, she realizes just how wrong she was. When Noel hires the marketing company where Lane is an intern, she’s forced to see him again. If she wants to land her dream job as executive within the company, she has to win him over and secure his account. Too bad Noel is still pissed at her for breaking his heart.",Rock the Heart,4.01,Kindle Edition,29344,16047244
"
                  ",503 pages,Kelly Elliott,2 edition,"The last thing Ellie expected was to fall in love with Gunner Mathews, a starting linebacker for the University of Te","
                  098870742X
                      ",3.98,Paperback,26083,16152943
English,236 pages,William Goldman,U.K. Paperback Edition; Movie tie-in cover,"Tom ""Babe"" Levy is a runner in every sense: racing tirelessly toward his goals of athletic and academic excellence--and endlessly away from the specter of his famous father's scandal-driven suicide. But an unexpected visit from his beloved older brother will set in motion a chain of events that plunge Babe into a vortex of terror, treachery, and murder--and force him into a race for his life . . . and for the answer to the fateful question, ""Is it safe?""",Marathon Man,4.11,Paperback,16523,21796
English,370 pages,Sarah Rees Brennan,First Edition,"Kami Glass loves someone she’s never met... a boy she’s talked to in her head ever since she was born. She wasn’t silent about her imaginary friend during her childhood, and is thus a bit of an outsider in her sleepy English town of Sorry-in-the-Vale. Still, Kami hasn’t suffered too much from not fitting in. She has a best friend, runs the school newspaper, and is only occasionally caught talking to herself. Her life is in order, just the way she likes it, despite the voice in her head.",Unspoken,3.85,Hardcover,24575,10866624
English,190 pages,Bill Willingham,Trade,"But that doesn't mean they don't have any room for romance—or the pain, betrayal and jealous rage that go along with it. In fact, love may be b","Fables, Volume 3: Storybook Love",4.15,Paperback,25735,21329
English,192 pages,Paulo Freire,30th Anniversary Edition,"First published in Portuguese in 1968, Pedagogy of the Oppressed was translated and published in English in 1970. The methodology of the late Paulo Freire has helped to empower countless impoverished and illiterate people throughout the world. Freire's work has taken on especial urgency in the United States and Western Europe, where the creation of a permanent underclass among the underprivileged and minorities in cities and urban centers is increasingly accepted as the norm. With a substantive new introduction on Freire's life and the remarkable impact of this book by writer and Freire confidant and authority Donaldo Macedo, this anniversary edition of Pedagogy of the Oppressed will inspire a new generation of educators, students, and general readers for years to come.",Pedagogia do Oprimido,4.25,Paperback,17790,72657
English,326 pages,Kelley Armstrong,First Edition,"Maya Delaney's paw-print birthmark is the mark of what she truly is - a skin-walker. She can run faster, climb higher, and see better than nearly everyone else. Experiencing intense connections with the animals that roam the woods outside her home, Maya knows it's only a matter of time before she's able to Shift and become one of them. And she believes there may be others in her small town with surprising talents.",The Calling,4.1,Hardcover,27580,11765920
English,486 pages,D.J. MacHale,1st S&S ed.,"Quillan is a territory on the verge of destruction. The people have lost control of their own future and must struggle simply to survive. The only chance they have of finding a better life is by playing the Quillan Games. Hosted by a strange pair of game masters, Veego and LaBerge, the games are a mix of sport and combat. They use the people of Quillan as pawns for their amusement as they force them to enter competitions that range from physical battles, to impossible obstacle courses, to computer-driven tests of agility. To triumph in the games is to live the life of a king. To lose is to die.",The Quillan Games,4.19,Hardcover,18960,215540
English,624 pages,George Eliot,Modern Library Classics Paperback Edition," was George Eliot's first full-length novel and a bestseller from the moment of publication. Eliot herself called it ""a country story - full of the breath of cows and scent of hay."" In the early days of the Napoleonic Wars, Adam Bede is hardworking carpenter with enormou",Adam Bede,3.77,Paperback,19546,20563
English,304 pages,Sylvain Neuvel,First Edition,"Seventeen years later, the mystery of the biza",Sleeping Giants,3.84,Hardcover,25427,25733990
English,374 pages,Julie Garwood,Reissue editon,"bestselling author Julie Garwood is a fan favorite—a beautiful lady needs rescue from a knight in shining armor, and gets an alpha warrior instead.",Honor's Splendour,4.22,Mass Market Paperback,23607,107774
English,384 pages,Michael J. Sullivan,First Edition,"A warrior with nothing to fight for is paired with a thieving assassin with nothing to lose. Together they must steal a treasure that no one can reach. The Crown Tower is the impregnable remains of the grandest fortress ever built and home to the realm’s most valuable possessions. But it isn’t gold or jewels the old wizard is after, and this prize can only be obtained by the combined talents of two remarkable men. Now if Arcadius can just keep Hadrian and Royce from killing each other, they just might succeed.",The Crown Tower,4.31,Paperback,19682,16043804
"
                  ",155 pages,Cherise Sinclair,1st edition,Master Z hasn't been so attracted to a woman in ye,"Club Shadowlands (Masters of the Shadowlands, #1)",3.99,Kindle Edition,28108,6357022
English,448 pages,James Patterson,Large Print,"James Patterson has created more enduring fictional characters than any other novelist writing today with his Alex Cross, Michael Bennett, Women’s Murder Club, Private, NYPD Red, Daniel X, Maximum Ride, and Middle School series. As of January 2016, he has sold over 350 million books worldwide and currently holds the Guinness World Record for the most #1 New York Times bestsellers. In addition to writing the thriller novels for which he is best known, he also writes children’s, middle-grade, and young-adult fiction and is also the first author to have #1 new titles simultaneously on the New York Times adult and children’s bestsellers lists.",Tick Tock,4.03,Hardcover,20401,8437913
English,374 pages,Harlan Coben,First Edition, bestselling author Harlan Coben’s blistering new Myron Bolitar thriller takes Myron—and his millions of fans—where they have never gone before,Long Lost,3.95,Hardcover,20991,3675828
English,416 pages,Emma Donoghue,First ,"The survivor, her friend Blanche Beunon, is a French burlesque dancer. Over the next three days, she will risk everything to bring Jenny's murderer to justice--if he doesn't track",Frog Music,3.13,Hardcover,19135,18295858
English,565 pages,Jorge Luis Borges,US / CAN,"Jorge Luis Borges has been called the greatest Spanish-language writer of our century. Now for the first time in English, all of Borges' dazzling fictions are gathered into a single volume, brilliantly translated by Andrew Hurley. From his 1935 debut with The Universal History of Iniquity, through his immensely influential collections Ficciones and The Aleph, these enigmatic, elaborate, imaginative inventions display Borges' talent for turning fiction on its head by playing with form and genre and toying with language. Together these incomparable works comprise the perfect one-volume compendium for all those who have long loved Borges, and a superb introduction to the master's work for those who have yet to discover this singular genius.",Cuentos completos,4.58,Paperback,16821,17961
"
                  ",390 pages,Fisher Amelie,3rd edition,Because mine is not the story you read e,English,4.25,Kindle Edition,28492,18331807
English,186 pages,H.P. Lovecraft,definitive,. The deliberately told and increasingly chilling recollection of an Antarctic expedition's uncanny discoveries --and their encounter with an untold,At the Mountains of Madness,3.92,Paperback,20424,32767
English,704 pages,Glen Cook,First Edition,"Then comes the prophecy: The White Rose has been reborn, somewhere, to embody good once more…",Chronicles of The Black Company (The Black Company / Shadows Linger / The White Rose),4.2,Paperback,18253,400924
English,32 pages,Jonathan Stroud,Unabridged,"It is 950 B.C.E., and King Solomon rules Jerusalem with a steely hand; a hand on which gleams a magic ring of immense and unforgiving power. Solomon has just begun work on his marvelous temple, charging Khaba, a formidable magician in his royal court, to oversee its construction. The workforce is an ill-behaved bunch of demons, a particularly unruly djinni named Bartimaeus among them. True to form, Bartimaeus promptly gets kicked off the temple project and assigned the even more miserable task of hunting bandits in the desert. There he crosses paths with Asmira, a highly skilled and loyal captain of the Queen of Sheba’s guard, on a suicidal mission to save her country from Solomon’s imminent attack. Of course, Bartimaeus has no intention of helping her. That is, until Asmira makes him an offer he cannot refuse. . . .",The Ring of Solomon,4.19,Audio CD,21928,7640705
English,288 pages,Scott Snyder,Deluxe Edition,"Then, in a second story called ""Hungry City,""",Batman: The Black Mirror,4.29,Hardcover,16679,10889279
English,220 pages,Graham Greene,Penguin Twentieth Century Classics,Although Greene objected strongly to being described as a “Catholic novelist” rather than as a “novelist who happened to be Ca,Our Man in Havana,3.94,Paperback,18628,133394
English,593 pages,Trudi Canavan,First Edition,When,The Magician's Apprentice,3.94,Hardcover,19203,3342764
English,365 pages,Amy Tintera,1st Edition,"Five years ago, Wren Connolly was shot three times in the chest. After 178 minutes she came back as a Reboot: stronger, faster, able to heal, and less emotional. The longer Reboots are dead, the less human they are when they return. Wren 178 is the deadliest Reboot in the Republic of Texas. Now seventeen years old, she serves as a soldier for HARC (Human Advancement and Repopulation Corporation).",Reboot,3.92,Hardcover,26005,13517455
English,543 pages,Scott Westerfeld,Simon Pulse,"While on their top-secret mission, Alek finally discovers Deryn's deeply kept secret. Two, actually. Not only is Deryn a girl disguised as a guy...she h",Goliath,4.25,Hardcover,25543,9918083
English,304 pages,Elisabeth Elliot,40th Anniversary Edition,"In 1956, five young men, including Elliot's husband, Jim, traveled into the jungles of Ecuador to establish communication with the fierce Huaorani Tribe, a people whose only previous response to the outside world has been to attack all strangers. The men's mission combined modern technology with innate ingenuity, sparked by a passionate determination to get the gospel to those without Christ. In a nearby village, their wives waited to hear from them. The news they received - all five missionaries had been murdered - changed lives around the world forever. Written while she was still a missionary in South America and at the request of the men's families, Through Gates of Splendor was Elisabeth Elliot's personal account of the final mission of these five courageous men. Filled with quotations from letters, material from personal journals, a wealth of photographs, and an epilogue update, this reprint of the original hardcover edition tells a lasting story of God's grace, unconditional love, and great courage. This story inspired the 2006 box office hit End of the Spear and is sure to inspire the next generation of servant believers.",Through Gates of Splendor,4.39,Paperback,17266,56634
"
                  ",318 pages,Toni Morrison,First Plume Printing (Oprah's Book Club),"""They shoot the white girl first. With the rest they can take their time."" So begins this visionary work from a storyteller. Toni Morrison's first novel since she was awarded the Nobel Prize for Literature, Paradise opens with a horrifying scene of mass violence and chronicles its genesis in an all-black small town in rural Oklahoma. Founded by the descendants of freed slaves and survivors in exodus from a hostile world, the patriarchal community of Ruby is built on righteousness, rigidly enforced moral law, and fear. But seventeen miles away, another group of exiles has gathered in a promised land of their own. And it is upon these women in flight from death and despair that nine male citizens of Ruby will lay their pain, their terror, and their murderous rage.","
                  0452280397
                      ",3.77,Paperback,19182,5198
English,247 pages,Jacob Tomsky,First Edition," to go into the hotel business. As a new college graduate, armed only with a philosophy degree and a singular lack of career direction, he became a valet parker for a large luxu","Heads in Beds: A Reckless Memoir of Hotels, Hustles, and So-Called Hospitality",3.54,Hardcover,17834,13331184
English,688 pages,Anna Todd,2nd edition,Tessa has everything to lose. Hardin has nothing to lose…except her. ,After We Collided,3.73,Paperback,25270,22540125
English,372 pages,James Patterson,Large Print,"On the night Malcolm and Maud Angel are murdered, Tandy Angel knows just three things: She was the last person to see her parents alive. The police have no suspe",Confessions of a murder suspect,3.89,Paperback,22877,13521399
English,30 pages,Diane Mowat,Oxford Bookworms Stage 1,"Without, the night was cold and wet, but in the small parlour of Laburnam Villa the blinds were drawn and the fire burned brightly. Father and son were at chess, the former, who possessed ideas about the game involving radical changes, putting his king into such sharp and unnecessary perils that it even provoked comment from the white-haired old lady knitting placidly by the fire. ""Hark at the wind,"" said Mr. White, who, having seen a fatal mistake after it was too late, was amiably desirous of preventing his son from seeing it. ""I'm listening,"" said the latter, grimly surveying the board as he stretched out his hand. ""Check."" ""I should hardly think that he'd come to-night,"" said his father, with his hand poised over the board.",The Monkey's Paw,3.85,Paperback,18246,351064
English,256 pages,L.M. Montgomery,Special Collector's Edition,"These boys and girls discover a special place all their own, but they never dream  of what will happen when the strangest family  moves into an old nearby mansion. The Meredith clan is  two boys and two girls, with minister father but  no mother -- and a runaway girl",Rainbow Valley,4.01,Paperback,29545,77395
English,184 pages,Stephen King,First edition,"On an island off the coast of Maine, a man is found dead. There's no identification on the body. Only the dogged work of a pair of local newspapermen and a graduate student in forensics turns up any clues. ",The Colorado Kid,3.28,Mass Market Paperback,22756,10574
English,399 pages,James Patterson,First Edition,"Everyone thinks Emmy Dockery is crazy. Obsessed with finding the link between hundreds of unsolved cases, Emmy has taken leave from her job as an FBI researcher. Now all she has are the newspaper clippings that wallpaper her bedroom, and her recurring nightmares of an all-consuming fire.",Invisible,4.05,Hardcover,19206,18656055
English,336 pages,Meg Cabot,First edition,Em was sure there couldn't be anything worse than being a brainiac in the body of a teenaged supermodel.,Being Nikki,3.86,Hardcover,26655,5135798
English,155 pages,Beverly Cleary,50th Anniversary Edition,"Just as Henry Huggins is complaining that nothing exciting ever happens, a friendly dog sits down beside him and looks pleadingly at his ice-cream cone.",Henry Huggins,3.97,Hardcover,22762,568476
"
                  ",690 pages,Elizabeth Chandler,Collector's Edition,": Ivy and Tristan have the love of a lifetime--until Tristan dies in a car accident. Now Tristan returns as an angel, but Ivy is unable to feel his presence. ","
                  0671023462
                      ",4.08,Paperback,24128,321645
"
                  ",406 pages,Penelope Douglas,2nd Edition,Have you ever been so angry that hitting things felt good? Or so numb that you actually felt high? The past few years have been like that for me. Traveling between fury and indifference with no stops in between.,Until You,4.36,ebook,30294,20803962
English,500 pages,Rohinton Mistry,Reprint Edition,"Rohinton Mistry’s enthralling novel is at once a domestic drama and an intently observed portrait of present-day Bombay in all its vitality and corruption. At the age of seventy-nine, Nariman Vakeel, already suffering from Parkinson’s disease, breaks an ankle and finds himself wholly dependent on his family. His step-children, Coomy and Jal, have a spacious apartment (in the inaptly named Chateau Felicity), but are too squeamish and resentful to tend to his physical needs.",Family Matters,3.99,Paperback,17892,19661
English,304 pages,Jack Campbell,Ace,"Captain John ""Black Jack"" Geary's legendary exploits are known to every schoolchild. Revered for his heroic ""la","Dauntless (The Lost Fleet, #1)",3.94,Mass Market Paperback,21516,112292
English,212 pages,Thomas S. Kuhn,3rd,"American historian and philosopher of science, a leading contributor to the change of focus in the philosophy and sociology of science in the 1960s. Thomas Samuel Kuhn was born in Cincinnati, Ohio. He received a doctorate in theoretical physics from Harvard University in 1949. But he later shifted his interest to the history and philosophy of science, which he taught at Harvard, the University of California at Berkeley, Princeton University, and Massachusetts Institute of Technology (MIT).",The Structure of Scientific Revolutions,3.99,Paperback,17596,61539
English,309 pages,Christopher Moore,First Edition,"The undead rise again in Bite Me, the third book in New York Times bestselling author Christopher Moore’s wonderfully twisted vampire saga. Joining his farcical gems Bloodsucking Fiends and You Suck, Moore’s latest in continuing story of young, urban, nosferatu style love, is no Twiligh",Bite Me,3.85,Hardcover,22411,6559316
