bookEdition,description,id,GoodReadAverageRating,Language,NumberofRatings,author,numberofpages,title,bookformat
Abridged," finds the two at the height of their powers, weaving together a broad range of approaches to self-realization and spiritual fulfillmen",836516,4.06,English,93,Deepak Chopra,0 pages,Living Beyond Miracles,Audio CD
"Revised, Third Edition","Approaches to Training and Development provides a comprehensive and practical introduction to the field of organizational training and human-resource development. It surveys the methods, functions, and goals of training--from needs assessment to implementation--illustrating each step of an effective training program. This new edition includes updates throughout, with fresh examples and current references, with an emphasis on evaluating and explaining new training. Comprehensive, authoritative, and accessible, this new edition will prove an essential resource to a new generation of trainers, HRD professionals, educators, and managers.",924656,3.73,English,11,Dugan Laird,352 pages,Approaches to Training and Development,Paperback
Large Print,"The CD-ROM provides: Boolean and proximity searches; complete text search; extensive support for bookmarking, journaling and annotation; interlinks leading to related topics and examples; zoom features for detailed viewing of figures and graphs; cut and paste capabilities for inserting text into other documents and programs; and an expandable table of contents providing instant access to text, tables and illustrations. Besides the complete 25th edition, this CD-ROM also contains important material from earlier editions of Machinery's Handbook. Extensive cross-referencing between the CD-ROM and Handbook make them ideal complements and the COMBO Specials a great value.",3369780,4.39,English,193,Erik Oberg,2554 pages,Machinery's Handbook,Hardcover
Second Edition," offers students with little or no background in statistical analysis an introduction to a broad spectrum of statistical concepts and methods. Written by authors well-known for their ability to convey difficult ideas clearly an directly, it succeeds by virtue of it s superior explanations, logical development of ideas, balanced presen",4778526,3.9,English,52,Robert R. Sokal,859 pages,Biometry,Hardcover
Large Print,"""There is something about everything that you can be glad about, if you keep hunting long enough to find it.""",3709042,3.95,English,61848,Eleanor H. Porter,310 pages,Pollyanna,Hardcover
Abridged,"Almost 40 years ago, Charles W. Colson was not thinking about reaching out to prison inmates or reforming the U.S. penal system. In fact, this aide to President Richard Nixon was ""incapable of humanitarian thought,"" according to the media of the mid-1970s. Colson was known as the White House ""hatchet man,"" a man feared by even the most powerful politicos during his four years of service to Nixon.",49274,4.18,English,3327,Charles W. Colson,0 pages,How Now Shall We Live?,Audio
German Edition,"Intelligent, ironisch, unterhaltsam - eine nostalgisch-",2043796,3.86,German,5773,David Lodge,308 pages,Changing Places,Paperback
Abridged,--a crystalline distillation of insights and wisdom accumulated over the lifetime of one of the g,526775,4.0,English,5028,Deepak Chopra,0 pages,The Book of Secrets,Audio CD
1,"Sabena Pierce had to run away from Paul McCann, the boy who had broken her heart. She sped out of the parking lot and away from the life that she once knew. After she is captured by Chelindren renegades, , Sabena discovers that her entire life has been a lie. She isn’t human and her mother committed a sin much worse than adultery. Sabena is a part of a magical race and there is war among the chelindren people. If she chooses to stand by her family, she will lose the one that she desperately loves. But Sabina is intent on not choosing at all. After Sunny MacPherson, a vindictive outlaw, sends vicious witchlings after her, Sabena will realize that her decision isn’t just between loyalty and love.",21857831,4.57,English,7,Debbie Civil,357 pages,The Hunter,Paperback
Complete Edition,"Katherine Mansfield (1888-1923) published three collections of short stories -- In a German Pension, Bliss, and The Garden Party -- during her tragically short life, and was acclaimed as one of modernism's most daring and original writers. After her death from tuberculosis in France, Mansfield's private writings and letters were edited by her husband, John Middleton Murry, and published in four volumes between 1927 and 1954. Murry, however, took liberties in recasting his wife's journals and notes. He excluded most of the vast mass of material and revised much of what he included, resulting in a distorted image of Mansfield as a passive, ethereal spirit.More than four decades later, the real Mansfield finally emerges in The Katherine Mansfield Notebooks, the first unexpurgated edition of her private writings. Fully and accurately transcribed by editor Margaret Scott, these infrequent diary entries, drafts of letters, introspective notes jotted on scraps of paper, unfinished stories, half-plotted novels, poems, recipes, and shopping lists offer a complete and compelling portrait of a complex woman who was ambitious and at times ruthless, neurotic and sexually voracious, witty and acerbic, fascinated with the minutiae of daily life and obsessed with death.",188088,4.23,English,39,Katherine Mansfield,665 pages,The Katherine Mansfield Notebooks,Paperback
Point Horror Unleashed,You do love me don't you Jonnie? You ,801203,3.21,English,19,Susan Price,174 pages,The Ghost Wife (Point Horror Unleashed S.),Paperback
Ace,"Born in her mother's hometown of Warren, Ohio, ",99441,4.21,                                  ,45005,Robin McKinley,292 pages,"
                  0441013058
                      ",Paperback
Unabridged,"Everything Daniel draws with his pencil--flying dragons, Octobears, and pizza-loving aliens from the planet Beezo--comes to life. It’s pretty awesome until the pencil draws a line between Daniel and his best (and only) frie",23590922,4.53,"
                  ",73,S.J. Henderson,2 pages,Daniel the Draw-er,Audible Audio
De Geus Ontdekkingen,"Byron, Martin en Inés - alledrie een jaar of zestien - zijn onafscheidelijk. Ze zitten in dezelfde klas en trekken ook buiten school veel met elkaar op. Ze praten over de boeken die ze gelezen hebben en vertrouwen elkaar hun geheimen toe.",13490451,3.13,Dutch,8,Susana Fortes,255 pages,Tiernos y traidores,Hardcover
Essential Penguin, in the Baltic. A grouse-shooting party or a weekend at Cowes would have been more Carruther’s style. More disconcerti,805035,3.63,English,4083,Erskine Childers,288 pages,The Riddle of the Sands,Mass Market Paperback
Large Print,"John D. MacDonald was born in Sharon, Pa, and educated at the Universities of Pennsylvania, Syracuse and Harvard, where he took an MBA in 1939. During WW2, he rose to the rank of Colonel, and while serving in the Army and in the Far East, sent a short story to his wife for sale, successfully. After the war, he decided to try writing for a year, to see if he could make a living. Over 500 short stor",1153252,3.6,English,434,John D. MacDonald,274 pages,Barrier Island,Hardcover
2nd edition,"The Duchess of Belcraven committed a folly, and bore her husband another man's child. Only a third son, however, so all was patched over. Then the two older boys drowned, leaving disaster. Now, over twenty years later, the duke discovers that he has a daughter, a child of his blood, and he compels the two to marry -- the arrogant ducal heir, devastated to learn for the first time that he is illegitimate; and the independent schoolteacher raised in the principles of the Rights of Women. Is there any common ground at all?",1144054,3.75,English,2338,Jo Beverley,351 pages,An Unwilling Bride,Mass Market Paperback
Second Edition,"So begins Firdaus's story, leading to her grimy Cairo prison cell, where she welcomes her death sentence as a relief from her pain and suffering. Born to a peasant family in the Egyptian countryside, Firdaus suffers a childhood of cruelty and",1008111,3.96,English,6048,Nawal El-Saadawi,114 pages,Dar el Addab,Paperback
Large Print,"In the summer of 1716, a Cornish cabin boy named Thomas Pellow and 52 of his comrades were captured at sea by the Barbary corsairs. Their captors—fanatical Islamic slave traders—had declared war on the whole of Christendom. Thousands of Europeans had been snatched from their homes and taken in chains to the great slave markets of Algiers, Tunis, and Sale in Morocco to be sold to the highest bidder. Drawn from unpublished letters and manuscripts written by slaves, and by the padres and ambassadors sent to free them, ",983949,4.02,English,667,Giles Milton,3 pages,White Gold,Audio CD
Unabridged - Library Edition,"Winner of the Pulitzer Prize in 1974 and the culmination of a life's work, The Denial of Death is Ernest Becker's brilliant and impassioned answer to the ""why"" of human existence. In bold contrast to the predominant Freudian school of thought, Becker tackles the problem of the vital lie: man's refusal to acknowledge his own mortality. In doing so, he sheds new light on the nature of humanity and issues a call to life and its living that still resonates more than thirty years after its publication. The Denial of Death was the last book Dr. Becker published before his premature death in 1974. His insightful and powerful ideas are sure to last for generations.",2764,4.19,English,4898,Ernest Becker,0 pages,The Denial Of Death,Audio CD
Abridged,"On this extraordinary audio program, Julia Butterfly Hill, the remarkable woman who inspired the world by living in a giant redwood tree named Luna to protest the practices of the logging industry, shares her story of commitment, perseverance, and courage with New Dimensions Radio host Michael Toms. The two engage in a compelling dialogue, with Hill recounting how she steadfastly remained in her leafy perch for two years, surviving wild weather and harassment from her opponents, while drawing international attention to the plight of redwoods. Hill's remarkable tree-sit ended in December of 1999, when she negotiated a deal with Pacific Lumber to save Luna from destruction.",99258,4.33,English,3,Julia Butterfly Hill,0 pages,Heart Of A Heroine: Saving the Last Redwoods,Audio
Abridged,"""THE DA VINCI CODE""",4225,4.19,"
                  ",18977,Dan Brown,11 pages,"
                  0743536916
                      ",Audio CD
Abridged,"It's a double-barreled mission for Mack Bolan: stop the terrorist attacks against the new president and deal a crippling blow to these subversive factions, including th",2468586,3.45,English,11,David  North,0 pages,Freedom Strike (Mack Bolan The Executioner #207) ,Audio
Collana Planet 115,"Continua la grande avventura di Yume, alla ricerca di sette motivi per cui questo nostro pianeta merita di esistere! Se non riuscirà nella sua impresa, un demone dalle fattezze di una deliziosa bambina distruggerà il mondo. Yume si sta impegnando con tutte le sue forze per mostrare al demone le meraviglie della Terra, ma non è facile. In questo numero, dovrà vedersela contro un’inaspettata rivale e soprattutto contro le proprie paure. Infatti, se vuole riuscire a salvare il mondo, dovrà prima di tutto cambiare se stessa!",18373204,4.0,                                  ,72,Mayu Sakai,176 pages,"MOMO 終末庭園へようこそ, 02",Paperback
Second Edition,"In this impressive second edition of Theory of Knowledge, Keith Lehrer introduces students to the major traditional and contemporary accounts of knowing. Beginning with the traditional definition of knowledge as justified true belief, Lehrer explores the truth, belief, and justification conditions on the way to a thorough examination of foundation theories of knowledge,the work of Platinga, externalism and naturalized epistemologies, internalism and modern coherence theories, contextualism, and recent reliabilist and causal theories. Lehrer gives all views careful examination and concludes that external factors must be matched by appropriate internal factors to yield knowledge. This match of internal and external factors follows from Lehrer's new coherence theory of undefeated justification. In addition to doing justice to the living epistemological traditions, the text smoothly integrates several new lines that will interest scholars. Also, a feature of special interest is Lehrer's concept of a justification game.This second edition of Theory of Knowledge is a thoroughly revised and updated version that contains several completely new chapters. Written by a well-known scholar and contributor to modern epistemology, this text is distinguished by clarity of structure, accessible writing, and an elegant mix of traditional material, contemporary ideas, and well-motivated innovation.",838965,3.37,English,19,Keith Lehrer,272 pages,Theory of Knowledge,Paperback
50th Anniversary Edition,"Awe and exhiliration--along with heartbreak and mordant wit--abound in Lolita, Nabokov's most famous and controversial novel, which tells the story of the aging Humbert Humbert's obsessive, devouring, and doomed passion for the nymphet Dolores Haze. Lolita is also the story of a hypercivilized European colliding with the cheerful barbarism of postwar America. Most of all, it is a meditation on love--love as outrage and hallucination, madness and transformation.",18133,3.88,English,521158,Vladimir Nabokov,317 pages,Lolita,Paperback
Special Gift Edition,"Hundreds of thousands of people around the world have read—and reread—Christopher Moore's irreverent, iconoclastic, and divinely funny tale of the early life of Jesus Christ as witnessed by his boyhood pal Levi bar Alphaeus (a.k.a. Biff). Now, in this special (check out the cool red ribbon marker, gilt-edged pages, and gold lettering) gift edition of Christopher Moore's bestselling ",446535,4.26,English,126527,Christopher Moore,417 pages,"Lamb: The Gospel According to Biff, Christ's Childhood Pal",Leather Bound
Penguin Classics,"One of George Eliot's most ambitious and imaginative novels, Romola is set in Renaissance Florence during the turbulent years following the expulsion of the powerful Medici family during which the zealous religious reformer Savonarola rose to control the city. At its heart is Romola, the devoted daughter of a blind scholar, married to the clever but ultimately treacherous Tito whose duplicity in both love and politics threatens to destroy everything she values, and she must break away to find her own path in life. Described by Eliot as 'written with my best blood', the story of Romola's intellectual and spiritual awakening is a compelling portrayal of a Utopian heroine, played out against a turbulent historical backdrop.",11095144,3.75,English,3334,George Eliot,688 pages,Romola,Paperback
Drama Classics,"Jean-Baptiste Poquelin, also known by his stage name, Molière, was a French playwright and actor who is considered one of the greatest masters of comedy in Western literature. Among Molière's best-known dramas are ",388812,3.66,English,24918,Molière,180 pages,"Le Tartuffe, ou L’Imposteur",Paperback
Penguin Classics," (1877) is the story of a woman's struggle for happiness in working-class Paris. At the center of the story stands Gervaise, who starts her own laundry and for a time makes a success of it. But her husband soon squanders her earnings in the Assommoir, a local drinking spot, and gradually the pair sink into poverty",2820826,4.06,English,9259,Émile Zola,480 pages,L'Assommoir,Paperback
Penguin Books 60th Anniversary," is the tragic romance of the young actress Rosemary Hoyt and the stylish American couple Dick and Nicole Diver. A brilliant young psychiatrist at the time of his marriage, Dick is both husband and doctor to Nicole, whose wealth goads him into a lifestyle not his own, and whose growing strength highlights Dick",1383812,3.83,English,87694,F. Scott Fitzgerald,400 pages,Tender Is the Night,Hardcover
Gesammelte Werke #60,"Karl Friedrich May (also Karol May) was one of the best selling German writers of all time, noted mainly for books set in the American Old West, (best known for the characters of Winnetou and Old Shatterhand) and similar books set in the Orient and Middle East. In addition, he wrote stories set in his native Germany, in China and in South America.",768593,3.77,German,62,Karl May,386 pages,Allah il Allah,Hardcover
Folio classique,", c'est l'instinct de mort dans le personnage principal, la fêlure cérébrale de Jacques Lantier, mécanicien de locomotive. Jeune homme, il pressent si bien la manière dont l'instinct de mort se déguise sous tous les appétits, l'Idée de mort sous toutes les idées fixes, la grande hérédité sous la petite, qu'il se tient à l'écart : d'abord des",105195,4.04,French,6238,Émile Zola,502 pages,La Bête humaine,Mass Market Paperback
"Bibliothek Suhrkamp, #1366","Bertolt Brecht (born Eugen Berthold Friedrich Brecht) was a German poet, playwright, and theatre director. A seminal theatre practitioner of the twentieth century, Brecht made equally significant contributions to dramaturgy and theatrical production, the latter particularly through the seismic impact of the tours undertaken by the Berliner Ensemble—the post-war theatre company operated by Brecht a",152994,3.93,German,843,Bertolt Brecht,157 pages,Geschichten vom Herrn Keuner,Hardcover
Special Illustrated Edition,", which has become one of the best selling novels of all time as well as the subject of intellectual debate among readers and scholars. Brown’s novels are published in 52 languages around the world with 200 million copies in print.",4227,3.86,English,2094520,Dan Brown,528 pages,Angels & Demons ,Hardcover
Large Print,"Here is one of the most practical guides to meditation. As a psychotherapist and researcher, Lawrence LeShan is more interested in the process and effects of meditation than the spiritual motivations. To LeShan, meditation means training the mind, and he likens it to physical exercise. Like a good trainer, he breaks down the different kinds of meditation into easy-to-learn steps and offers counsel about the best ways to go about it and the pitfalls you are likely to encounter. LeShan isn't pure vanilla, however. He wrote at a time (the early '70s) when meditation was still considered esoteric and strongly associated with the paranormal. Still, he keeps his feet on the ground and suggests that you do, too. Meditation, he says, helps get a new perspective on the world and to attain ""an increased serenity and competence in being."" If you are a beginning meditator, this perennial favorite is a good place to start. ",2457492,3.74,English,421,Lawrence LeShan,285 pages,How to Meditate: A Guide to Self-Discovery,Hardcover
Sotterranei #95,I protagoni,9673658,3.59,Italian,190,A.L. Kennedy,215 pages,Indelible Acts,Paperback
Readers Circle,"Joe Maloney is out of place in this world. His mother wants him to be a man, and he can’t be that yet. His only friend, Stanny Mole, wants to teach him how to kill, and Joe can’t learn that. Joe’s mind is always somewhere else: on the weird creatures he sees in the distant sky, the songs he hears in the air around him, the vibrations of life he feels everywhere. Everybody laughs at Joe Maloney.",2424548,3.56,English,294,David Almond,224 pages,Secret Heart ,Mass Market Paperback
Large Print,"Mildred Grieveson was born on October 10, 1946 in England. She had writtenall through her infant and junior years and on into her teens, the storieschanging from children's adventures to torrid gypsy passions. Her motherused to gather these up from time to time, when her bedroom became toountidy, and dispose of them!",1739475,3.33,English,3,Anne Mather,186 pages,A Millionaire Boyfriend,Hardcover
Harlequin Presents Plus #1719,"Debra Latham followed her instructions closely when she was persuaded by her private detective sister to keep a watch on a suspicious client. But no instructions told her how to cope with an angry man who believed she was spying on him, or how to defend herself against his impassioned kisses. Marsh Graham turned out to be completely innocent and, embarrassingly for Debra, he was also her new boss. Not exactly the most auspicious of starts to a working relationship.",34835,2.63,English,27,Penny Jordan,186 pages,"A Matter of Trust (Harlequin Presents Plus, No 1719)",Paperback
First Edition,"The theme is that of the conflict, which came t",18621486,5.0,                                  ,3,Vardis Fisher,448 pages,The Island of the Innocent,Hardcover
Shambhala Dragon Editions,", ",1057985,4.31,English,288,Chögyam Trungpa,296 pages,Great Eastern Sun: The Wisdom of Shambhala,Paperback
By Request,The Bravo Family Way ,14854113,3.79,English,48,Christine Rimmer,560 pages,Bravo Family Ties,Paperback
Abridged,Prosecutor Ellen North believes she's buil,11345814,4.1,English,14617,Tami Hoag,0 pages,Guilty as Sin (Deer Lake #2),Audio CD
Large Print,W.E.B. Griffin is one of several pseudonyms for ,9813320,3.91,English,1483,W.E.B. Griffin,568 pages,The Double Agents,Hardcover
First edition,"Secrete întunecate si suspiciuni nemărturisite amenință prietenia dintre Zoey si Stevie Rae. Nelinistită de legătura ei profundă cu A-ya, fecioara plăsmuită de femeile Cherokee pentru a-l seduce pe maleficul Kalona, Zoey se luptă să-si înfrangă dorinta de a-l iubi pe frumosul înger căzut, cand acesta încearcă in fel si chip să o prindă in mrejele sale. Înca o dată, Întunericul amenință să pună stăpanire pe Casa Nopții.",12659235,3.96,English,138437,P.C. Cast,367 pages,Tempted,Hardcover
Special Illustrated Edition,"While in Paris on business, Harvard symbologist Robert Langdon receives an urgent late-night phone call: the elderly curator of the Louvre has been murdered inside the museum. Near the body, police have found a baffling cipher. While working to solve the enigmatic riddle, Langdon is stunned to discover it leads to a trail of clues hidden in the works of Da Vinci -- clues visible for all to see -- yet ingeniously disguised by the painter.",969,3.79,English,1564680,Dan Brown,480 pages,The Da Vinci Code,Paperback
Kaliber,"Det er onsdag 5. august 1970, og førstebetjent Kolbjørn ""K2"" Kristiansen er på vei hjem etter et rutineoppdrag på Smestad, da han blir vitne til en ung kvinne som i vill panikk løper etter trikken uten å nå den. En time senere finner han kvinnen skutt og drept, liggende i trikkesporet. Det viser seg raskt at kvinnen tilhørte en gruppe unge sosialister. Og hun var forlovet med gruppens karismatiske leder, som på dagen to år tidligere forsvant på uforklarlig vis under en hyttetur i Valdres.",24852550,3.76,"
                  ",276,Hans Olav Lahlum,345 pages,Katalysatormordet,Paperback
El Barco de Vapor Naranja,"La llegada de la primavera revoluciona a fray Perico y a sus compañeros. Y es que dicha estación no solo lleva al convento las flores y el buen tiempo, sino también a unos ladrones un tanto atípicos y hasta a unos soldados franceses. Pero... ¿qué pasará? ¿conseguirán finalmente acabar con la paciencia del pacífico fraile? Un libro donde se entremezcla el humor, la inocencia y la solidaridad.",2117450,4.0,Spanish,12,Juan Muñoz Martín,108 pages,Fray Perico y la primavera,Paperback
Abridged,"Douglas Preston was born in Cambridge, Massachusetts, in 1956, and grew up in the deadly boring suburb of Wellesley. Following a distinguished career at a private nursery school--he was almost immediately expelled--he attended public schools and the Cambridge School of Weston. Notable events in his early life included the loss of a fingertip at the age of three to a bicycle; the loss of his two fr",1228554,4.13,English,25524,Douglas Preston,0 pages,The Book of the Dead,Audio CD
40th Anniversary Edition," is the story of the boy Paul Atreides, who would become the mysterious man known as Muad'Dib. He would avenge the traitorous plot against his noble family--and would bring to fruition humankind's most ancient and unattainable dream.A stunning blend of adve",104,4.19,English,530290,Frank Herbert,528 pages,Dune,Paperback
Harlequin Intrigue Series,"Despite his dark past and dangerous edge, Jordan Taylor fell for the helpless infant left on his Texas doorstep with a frantic plea for help. The millionaire security agent had built a fortress around baby Gus...or so he thought until Kinley Ford showed up at Christmas fourteen months later.Kinley wanted only to see her son; instead she'd led the killers on her heels straight to Gus. Killers who wouldn't hesitate to use him as the ultimate pawn. Kinley got to Jordan's heart, and after a lifetime of loss, he vowed to sacrifice everything to protect his surrogate son and the woman who'd ensnared him. Everything. Even his life.",6799527,4.15,"
                  ",78,Delores Fossen,218 pages,"
                  037369430X
                      ",Paperback
چاپ پنجم,جلال آل احمد در تهران به دنیا آمد. در ۱۳۲۳ به حزب توده پیوست و سه سال بعد در انشعابی جنجالی از آن کناره گرفت. نخستین مجموعه داستان خود به نام «دید و بازدید» را در همین دوران منتشر کرده بود. او که تاثیری گسترده بر جریان روشنفکری دوران خود داشت، به جز نوشتن داستان به نگارش مقالات اجتماعی، پژوهش های مردم شناسی، سفرنامه ها و ترجمه های متعددی نیز پرداخت. شاید مهم ترین ویژگی ادبی آل احمد نثر او بود. نثر,58250,3.04,Persian,662,Jalal Al-e Ahmad,107 pages,از رنجی که می بریم,Paperback
