Language,numberofpages,author,bookEdition,description,title,GoodReadAverageRating,bookformat,NumberofRatings,id
English,416 pages,Harlan Coben,First Edition,"Tia and Mike Baye never imagined they'd become the type of overprotective parents who spy on their kids. But their sixteen-year-old son Adam has been unusually distant lately, and after the suicide of his classmate Spencer Hill - the latest in a string of issues at school - they can't help but worry. They install a sophisticated spy program on Adam's computer, and within days they are jolted by a message from an unknown correspondent addressed to their son - 'Just stay quiet and all safe.' ",Hold Tight,3.94,Hardcover,33739,2177236
English,362 pages,Sherrilyn Kenyon,+ preview Seize the Night,She just never expected her knight in shining armor to have a shiny coat of fur...,Night Play,4.36,Mass Market Paperback,44630,84151
English,480 pages,Jo Nesbø,1st US,"A man is caught on CCTV, shooting dead a cashier at a bank. Detective Harry Hole begins his investigation, but after dinner with an old flame wakes up with no memory of the past 12 hours. Then the girl is found dead in mysterious circumstances and he beings to receive threatening emails: is someone trying to fra",Sorgenfri,3.98,Paperback,40024,3522419
English,342 pages,Patricia Briggs,First Edition," was praised as ""an urban fantasy where our everyday world is believably twisted into the world of fey, werewolves, vampires, and myths made real."" Now Mercy Thompson faces a shapeshifter's biggest fear as the realm she has embraced is thrown into chaos...",Frost Burned,4.35,Hardcover,48555,13413589
English,371 pages,Harlan Coben,First Edition,", in 1995, introducing a hero that would captivate millions. Over the years we have watched Myron walk a tight ro",Live Wire,4.07,Hardcover,31967,8437667
English,679 pages,Elizabeth Gaskell,Penguin Classics," centres on the story of youthful Molly Gibson, brought up from childhood by her father. When he remarries, a new step-sister enters Molly's quiet life – loveable, but worldly and troubling, Cynthia. The narrative traces the development of the two girls into womanhood within the gossiping and watchful s",Wives and Daughters,4.07,Paperback,34880,383206
English,44 pages,Virginia Lee Burton,Weekly Reader Edition,", a poignant story of a cute country cottage that becomes engulfed by the city that grows up around it. The house has an expressive face of windows and doors, and even the feelings of a person, so she’s sad when she’s surrounded by the dirty, noisy city’s hustle and bustle: “",The Little House,4.29,Hardcover,34516,153540
English,357 pages,Eoin Colfer,First American Edition,"Captain Holly Short is unconvinced, and discovers that Artemis is suffering from Atlanti",The Atlantis Complex,3.97,Hardcover,42673,7005865
English,246 pages,Vladimir Nabokov,Penguin Modern Classics, published in 1962 after the critical and popular success of Lolita had made him an international literary figure.,Pale Fire,4.19,Paperback,31049,7805
English,927 pages,Neal Stephenson,P.S. Edition (USA),It is a chronicle of the breathtaking exp,Quicksilver,3.92,Paperback,30900,823
English,64 pages,Dr. Seuss,Dr. Seuss Blue Back Books,"Theodor Seuss Geisel was born 2 March 1904 in Springfield, MA. He graduated Dartmouth College in 1925, and proceeded on to Oxford University with the intent of acquiring a doctorate in literature. At Oxford he met Helen Palmer, who he wed in 1927. He returned from Europe in 1927, and began working for a magazine called Judge, the leading humor magazine in America at the time, submitting both carto",Hop on Pop,3.95,Paperback,40238,206962
English,238 pages,David Mitchell,1st Edition,". A stranger will greet you by name and invite you inside. At first, you won’t want to leave. Later, you’ll find that you can’t. Every nine years, the house’s re",Slade House,3.82,Hardcover,32056,24499258
"
                ",240 pages,Sarah Silverman,Alt Cover for ISBN: 9780061856433,"From the outrageously filthy and oddly innocent comedienne Sarah Silverman comes a memoir—her first book—that is at once shockingly personal, surprisingly poignant, and still pee-in-your-pants funny. If you like Sarah’s television show The Sarah Silverman Program, or memoirs such as Chelsea Handler’s Are You There Vodka? It’s Me Chelsea and Artie Lange’s Too Fat to Fish, you’ll love The Bedwetter.","The Bedwetter: Stories of Courage, Redemption and Pee",3.52,Hardcover,30340,7897478
English,341 pages,Augustine of Hippo,Oxford World's Classics,"Augustine's Confessions is one of the most influential and most innovative works of Latin literature. Written in the author's early forties in the last years of the fourth century A.D. and during his first years as a bishop, they reflect on his life and on the activity of remembering and interpreting a life. Books I-IV are concerned with infancy and learning to talk, schooldays, sexual desire and adolescent rebellion, intense friendships and intellectual exploration. Augustine evolves and analyses his past with all the resources of the reading which shaped his mind: Virgil and Cicero, Neoplatonism and the Bible. This volume, which aims to be usable by students who are new to Augustine, alerts readers to the verbal echoes and allusions of Augustine's brilliant and varied Latin, and explains his theological and philosophical questioning of what God is and what it is to be human. The edition is intended for use by students and scholars of Latin literature, theology and Church history.",Confessiones Sancti Patris nostri Augustini,3.89,Paperback,33832,27037
English,320 pages,Dorothy Allison,Plume Essential Edition,"Dorothy Allison is an American writer, speaker, and member of the Fellowship of Southern Writers. Themes in Allison's work include class struggle, child and sexual abuse, women, lesbianism, feminism, and family.",Bastard Out of Carolina,4.09,Mass Market Paperback,32762,25354
English,192 pages,Gary Russell,1st edition,". This official publication contains 500 exclusive images, from the earliest pencil sketches and conceptual drawings to magnificant full-color paintings that shaped the look of the film. A",The Lord of the Rings: The Art of The Fellowship of the Ring,4.59,Hardcover,24457,119
"
                ",584 pages,عائض القرني,الطبعة العاشرة,"""خطّ المؤلف في هذه الصفحات علاجاً لمن عاش ضائقة أو ألمّ به حزن أو هم، أو طاف به طائف من مصيبة، أو أقضي مضجعه أرق، وشرد نومه قلق. وأينا يخلو من ذلك. هنا في طيات هذا الكتاب آيات وأبيات، صور وعبر، وفوائد وشوارد، وأمثال وقصص، وسكبت فيها عصارة ما وصل إليه اللامعون، من وراء القلب المفجوع، والروح المنهكة، والنفس الحزينة البائسة، وهذه التجارب تقول للإنسان: أبشر واسعد، وتفاءل واهدأ، وعش الحياة كما هي، طيبة رضية بهيجة.""",لا تحزن,4.15,Paperback,25053,2750180
English,1032 pages,Rick Riordan,Boxed Set,"Percy Jackson is a good kid, but he can't seem to focus on his schoolwork or control his temper. When his mom tells him the truth about wh",Percy Jackson and the Olympians Boxed Set,4.58,Paperback,33273,3165162
English,180 pages,A.P.J. Abdul Kalam,27th impression,"Avul Pakir Jainulabdeen Abdul Kalam, the son of a little-educated boat-owner in Rameswaram, Tamil Nadu, had an unparalleled career as a defence scientist, culminating in the highest civilian award of India, the Bharat Ratna. As chief of the country's defence research and development programme, Kalam demonstrated the great potential for dynamism and innovation that existed in seemingly moribund research establishments. This is the story of Kalam's rise from obscurity and his personal and professional struggles, as well as the story of Agni, Prithvi, Akash, Trishul and Nag-missiles that have become household names in India and that have raised the nation to the level of a missile power of international reckoning. This is also the saga of independent India's struggle for technological self-sufficiency and defensive autonomy-a story as much about politics, domestic and international, as it is about science.",Wings of Fire: An Autobiography,4.19,Paperback,26981,634583
English,728 pages,Sherrilyn Kenyon,1st Edition,"Eleven thousand years ago a god was born. Cursed into the body of a human, Acheron spent a lifetime of shame. However, his human death unleashed an unspeakable horror that almost destroyed the earth. Then, brought back against his will, Acheron became the sole defender of mankind.","Acheron (Dark-Hunter, #15) - Part 1",4.59,Hardcover,47990,2299110
English,251 pages,Anne Brontë,Penguin Classics,At age 19 Anne Brontë left home and worked as a governess for a few years before becoming a writer. Agnes Grey was an 1847 novel based on her experience as a governess. Bronte depicts the precarious position of a governess and how that can affect a young woman. Agnes was the daughter of a minister whose family was in financial difficulty. She has only a few choices for employment. Agnes experiences the difficulty of reining in spoiled children and how wealth can corrupt morals.,Agnes Grey,3.65,Paperback,38955,298230
English,324 pages,Alan Weisman,First Edition,"In The World Without Us, Alan Weisman offers an utterly original approach to questions of humanity's impact on the planet: he asks us to envision our Earth, without us.In this far-reaching narrative, Weisman explains how our massive infrastructure would collapse and finally vanish without human presence; which everyday",The World Without Us,3.79,Hardcover,30786,248787
English,152 pages,Brian K. Vaughan,Trade,: ,"Saga, Volume Four",4.47,Paperback,39808,23093367
English,382 pages,Cory Doctorow,Tor,But his whole world changes when he and his friends find themselves caught in the aftermath of a,Little Brother,3.94,Hardcover,39978,954674
English,387 pages,Harlan Coben,First Edition,"Megan is a suburban soccer mom who once upon a time walked on the wild side. Now she’s got two kids, a perfect husband, a picket fence, and a growing sense of dissatisfaction. Ray used to be a talented documentary photographer, but at age forty he finds himself in a dead-end job posing as a paparazzo pandering to celebrity-obsessed rich kids. Jack is a detective who can’t let go of a cold case—a local husband and father disappeared seventeen years ago, and Jack spends the anniversary every year visiting a house frozen in time, the missing man’s family still waiting, his slippers left by the recliner as if he might show up any moment to step into them. Three people living lives they never wanted, hiding secrets that even those closest to them would never suspect, will find that the past doesn’t recede. Even as the terrible consequences of long-ago events crash together in the present and threaten to ruin lives, they will come to the startling realization that they may not want to forget the past at all. And as each confronts the dark side of the American Dream—the boredom of a nice suburban life, the excitement of temptation, the desperation and hunger that can lurk behind even the prettiest facades—they will discover the hard truth that the line between one kind of life and another can be as whisper-thin as a heartbeat. With his trademark combination of page-turning thrills and unrivaled insight into the dark shadows that creep into even the happiest communities, Harlan Coben delivers a thriller that cements his status as the master of domestic suspense.",Stay Close,3.87,Hardcover,33026,11737271
English,463 pages,Orhan Pamuk,First Vintage International edition,"From the acclaimed author of My Name Is Red comes a spellbinding tale of disparate yearnings–for love, art, power, and God–set in a remote",Kar,3.55,Paperback,30699,11691
English,283 pages,John Fowles,Vintage Classics," was born in Leigh-on-Sea, a small town located about 40 miles from London in the county of Essex, England. He recalls the English suburban culture of the 1930s as oppressively conformist and his family life as intensely conventional. Of his childhood, Fowles says ""I have tried to escape ever since.""",The Collector,3.99,Paperback,37552,243705
English,650 pages,Ernest Hemingway,Finca Vigia, ,The Complete Short Stories of Ernest Hemingway,4.28,Paperback,30446,4625
English,313 pages,Janet Evanovich,First Edition,"For centuries, treasure hunters have been eager to possess the stones, undeterred by their corrupting nature. The list is long — Genghis Khan, Alexander the Great, Napoleon, to name a few. Now the Stones have found their way to Salem, Massachusetts, and so has Gerwulf Grimoire, adding himself to this rogues’ gallery of power seekers. He’s an uncommonly dangerous man, with a hunger for the forbidden, and a set of abilities that are way beyond ordinary. Abilities that he feels entitle him to possess anything he might desire.",Wicked Appetite,3.77,Hardcover,42909,8205669
English,260 pages,Ilona Andrews,Ace,"As a mercenary who cleans up after magic gone wrong, Kate Daniels has seen her share of occupational hazards. Normally, waves of paranormal energy ebb and flow across Atlanta like a tide. But once every seven years, a flare comes, a time when magic runs rampant. Now Kate’s going to have to deal with problems",Magic Burns,4.33,Mass Market Paperback,55942,1811543
English,73 pages,Edgar Allan Poe,Scholastic Classics,"The Raven . . . Annabel Lee . . . Ulalume . . . these are some of the spookiest, most macabre poems ever written, now collected in this chilling, affordable volume.",The Raven and Other Poems,4.3,Paperback,34760,269322
English,488 pages,Nora Roberts,First Edition,"Several years ago, Fiona was the only survivor of the Red Scarf Ki",The Search,4.11,Hardcover,38868,7076706
English,470 pages,John Fowles,Vintage Classics,"The scene is the village of Lyme Regis on Dorset's Lyme Bay...""the largest bite from the underside of England's out-stretched southwestern leg."" The major characters in the love-intrigue triangle are Charles Smithson, 32, a gentleman of independent means & vaguely scientific bent; his fiancée, Ernestina Freeman, a pretty heiress daughter of a wealthy & pompous dry goods merchant; & Sarah Woodruff, mysterious & fascinating...deserted after a brief affair with a French naval officer a short time before the story begins. Obsessed with an irresistible fascination for the enigmatic Sarah, Charles is hurtled by a moment of consummated lust to the brink of the existential void. Duty dictates that his engagement to Tina must be broken as he goes forth once again to seek the woman who has captured his Victorian soul & gentleman's heart.",The French Lieutenant's Woman,3.86,Paperback,39030,56034
English,430 pages,Lawrence Wright,First Edition,". Based on more than two hundred personal interviews with both current and former Scientologists--both famous and less well known--and years of archival research, Lawrence Wright uses his extr","Going Clear: Scientology, Hollywood, and the Prison of Belief",4.02,Hardcover,30780,16142053
English,466 pages,Samantha Shannon,US,It is raining the day her life chan,The Bone Season,3.75,Hardcover,42977,17199504
English,184 pages,Jerome K. Jerome,Penguin Popular Classics,"Martyrs to hypochondria and general seediness, J. and his friends George and Harris decide that a jaunt up the Thames would suit them to a ‘T’. But when they set off, they can hardly predict the troubles that lie ahead with tow-ropes, unreliable weather forecasts and tins of pineapple chunks—not to mention the devastation left in the wake of J.’s small fox-terrier Montmorency.",Three Men in a Boat (To Say Nothing of the Dog),3.9,Mass Market Paperback,39324,4921
English,164 pages,Janet Evanovich,First Edition,"Mysterious men have a way of showing up in Stephanie Plum's apartment. When the shadowy Diesel appears, he has a task for Stephanie--and he's not taking no for an answer. Annie Hart is a ""relationship expert"" who is wanted for armed robbery and assault with a deadly weapon. Stephanie needs to find her, fast. Diesel knows where she is. So they make a deal: He'll help her get Annie if Stephanie plays matchmaker to several of Annie's most difficult clients. But someone wants to find Annie even more than Diesel and Stephanie. Someone with a nasty temper. And someone with ""unmentionable"" skills. Does Diesel know more than he's saying about Annie Hart? Does Diesel have secrets he's keeping from Stephanie and the two men in her life--Ranger and Morelli? With Stephanie Plum in over her head, things are sure to get a little dicey and a little explosive, Jersey style!",Plum Lovin',3.7,Hardcover,45773,6419
English,359 pages,Kelley Armstrong,First Edition,"Sixteen-year-old Maya is just an ordinary teen in an ordinary town. Sure, she doesn't know much about her background - the only thing she really has to cling to is an odd paw-print birthmark on her hip - but she never really put much thought into who her parents were or how she ended up with her adopted parents in this tiny medical-research community on Vancouver Island.",The Gathering,4.03,Hardcover,51186,7896345
English,240 pages,Alexander Pushkin,Oxford World's Classics,"Eugene Onegin is the master work of the poet whom Russians regard as the fountainhead of their literature. Set in imperial Russia during the 1820s, Pushkin's novel in verse follows the emotions and destiny of three men - Onegin the bored fop, Lensky the minor elegiast, and a stylized Pushkin himself - and the fates and affections of three women - Tatyana the provincial beauty, her sister Olga, and Pushkin's mercurial Muse. Engaging, full of suspense, and varied in tone, it also portrays a large cast of other characters and offers the reader many literary, philosophical, and autobiographical digressions, often in a highly satirical vein. Eugene Onegin was Pushkin's own favourite work, and it shows him attempting to transform himself from romantic poet into realistic novelist. This new translation seeks to retain both the literal sense and the poetic music of the original, and capture the poem's spontaneity and wit. The introduction examines several ways of reading the novel, and the text is richly annotated.",Евгений Онегин: Роман в стихах ,4.08,Paperback,38364,27822
English,302 pages,P.C. Cast,First Edition,With the seeds of distrust sown and Darkness breeding chaos at the Hous,Hidden,3.98,Hardcover,42518,7933615
English,389 pages,James Patterson,First Edition,"Just when Alex thought his life was calming down into a routine of patients and therapy sessions, he finds himself back in the game--this time to catch a criminal mastermind like no other. A spate of elaborate murders in Washington D.C. have the whole East Coast on edge. They are like nothing Alex Cross and his new girlfriend, Detective Brianna Stone, have ever seen. With each murder, the case becomes increasingly complex. There's only one thing Alex knows: the killer adores an audience. As victims are made into gruesome spectacles citywide, inducing a media hysteria, it becomes clear to Alex that the man he's after is a genius of terror--and he's after fame. The killer has the whole city by its strings--and he'll stop at nothing to become the most terrifying star that Washington D.C. has ever seen",Double Cross,3.99,Hardcover,36999,552887
English,822 pages,Douglas R. Hofstadter,20th Anniversary Edition,"Douglas Hofstadter's book is concerned directly with the nature of “maps” or links between formal systems. However, according to Hofstadter, the formal system that underlies all mental activity transcends the system that supports it. If life can grow out of the formal chemical substrate of the cell, if consciousness can emerge out of a formal system of firing neurons, then so too will computers attain human intelligence. Gödel, Escher, Bach is a wonderful exploration of fascinating ideas at the heart of cognitive science: meaning, reduction, recursion, and much more.","Gödel, Escher, Bach: An Eternal Golden Braid",4.3,Paperback,33831,24113
English,469 pages,Tamora Pierce,First Trade Paperback Edition," beautiful, dramatic, and rash - will she fulfill the role chosen for her by destiny?",Trickster's Queen,4.28,Paperback,47705,153780
English,734 pages,James Clavell,Reprint,.,Tai-Pan,4.25,Mass Market Paperback,36495,42933
English,96 pages,Edwin A. Abbott,Dover Thrift Edition,"Edwin Abbott Abbott (December 20, 1838 - 1926), English schoolmaster and theologian, is best known as the author of the mathematical satire Flatland (1884).",Flatland: A Romance of Many Dimensions,3.81,Paperback,39661,433567
English,608 pages,J.R. Ward,First Edition,"Qhuinn, son of no one, is used to being on his own. Disavowed from his bloodline, shunned by the aristocracy, he has finally found an identity as one of the most brutal fighters in the war against the Lessening Society. But his life is not complete. Even as the prospect of having a family of his own seems to be within reach, he is empty on the inside, his heart given to another....",Lover at Last,4.3,Hardcover,52293,13570854
English,455 pages,Kim Harrison,1st Edition,"As Rachel searches for the truth behind a terrifying murder, an even greater menace threatens, for the demon Algaliarept will stop at nothing to claim her, and the discovery of a shocking family secret throws Rachel'",The Outlaw Demon Wails ,4.38,Hardcover,47754,1225621
English,468 pages,Dan Wells,1st Edition,"Humanity is all but extinguished after a war with Partials—engineered organic beings identical to humans—has decimated the population. Reduced to only tens of thousands by a weaponized virus to which only a fraction of humanity is immune, the survivors in North America have huddled together on Long Island. But sixteen-year-old Kira is determined to find a solution. As she tries desperately to save what is left of her race, she discovers that that the survival of both humans and Partials rests in her attempts to answer questions about the war's origin that she never knew to ask.",Partials,3.94,Hardcover,45222,12476820
English,432 pages,Margret Rey,70th Anniversary Edition,"“This is George. He lived in Africa. He was a good little monkey, and always very curious.” With these words, H. A. and Margret Rey introduced the world to Curious George in 1941, and the world has loved him ever since. The tales of this cheerful and resilient little hero have kept generations of readers enthralled and entertained. Now, in recognition of the sixtieth anniversary of his debut, Houghton Mifflin proudly presents a special edition of George’s best-loved adventures.",The Complete Adventures of Curious George,4.23,Hardcover,40004,808853
English,456 pages,Kim Harrison,1st Edition,"Despite dating one vampire and living with another, Rachel Morgan has stayed ahead of trouble until now. A serial killer stalks the Hollows, claims victims across society, and ignites a vicious Inderland gang war. Rachel hides an ancient artifact that could stop the killer or start a battle to the death among supernatural races of Cincinnati. Every action has its price. When the vampire master Piscary is set free and the demonic Algaliarept dares to walk openly under the sun, even Rachel Morgan can't hide forever.",For a Few Demons More ,4.33,Hardcover,48631,30259
English,640 pages,Larry Niven,#20813-3,"The gigantic comet had slammed into Earth, forging earthquakes a thousand times too powerful to measure on the Richter scale, tidal waves thousands of feet high. Cities were turned into oceans; oceans turned into steam. It was the beginning of a new Ice Age and the end of civilization. But for the terrified men and women chance had saved, it was also the dawn of a new struggle for survival--a struggle more dangerous and challenging than any they had ever known.",Lucifer's Hammer,3.98,Mass Market Paperback,35163,218467
English,622 pages,Isabel Wilkerson,1st,"From 1915 to 1970, this exodus of almost six million people changed the face of America. Wilk",The Warmth of Other Suns: The Epic Story of America's Great Migration ,4.32,Hardcover,35065,8171378
English,160 pages,Jean Rhys,Essential Penguin Edition,"Jean Rhys, originally Ella Gwendolen Rees Williams, was a Caribbean novelist who wrote in the mid 20th century. Her first four novels were published during the 1920s and 1930s, but it was not until the publication of Wide Sargasso Sea in 1966 that she emerged as a significant literary figure. A ""prequel"" to Charlotte Brontë's Jane Eyre, Wide Sargasso Sea won a prestigious WH Smith Literary Award i",Wide Sargasso Sea,3.57,Paperback,45771,44597
English,243 pages,L.M. Montgomery,Special Collector's Edition,"A new life means fresh problems to solve, fresh surprises. Anne and Gilbert",Rainbow Valley,4.12,Mass Market Paperback,62035,77394
English,221 pages,Vera Brosgol,First Edition,"Falling down a well is bad enough, but Anya's normal life might actually be worse. She's embarrassed by her family, self-consc",Anya's Ghost,3.88,Hardcover,42878,9615347
English,373 pages,Amanda Lindhout,Canadian,"As a child, Amanda Lindhout escaped a violent household by paging through issues of ",A House in the Sky,4.2,Hardcover,33584,18039963
English,453 pages,Kim Harrison,1st Edition,"Kim Harrison, author of the New York Times #1 best selling Hollows series, was born in Detroit and lived most her her life within an easy drive. She's currently working on a variety of projects to see what finds a home first, and when not at her desk, is most likely to be found landscaping her new/old Victorian home, or in the garden.","The Good, the Bad, and the Undead",4.26,Mass Market Paperback,53268,30262
